name,datetime,tempmax,tempmin,temp,feelslikemax,feelslikemin,feelslike,dew,humidity,precip,precipprob,precipcover,preciptype,snow,snowdepth,windgust,windspeed,winddir,sealevelpressure,cloudcover,visibility,solarradiation,solarenergy,uvindex,severerisk,sunrise,sunset,moonphase,conditions,description,icon,stations
"-6.2155, 106.803",1/1/2022,32.1,25,28.5,37.6,25,31.8,24,77.5,0.507,100,12.5,rain,0,0,37.1,21.6,261.3,1009.6,49.8,6.8,249.2,20.6,9,,2022-01-01T05:41:59,2022-01-01T18:10:28,0.95,"Rain, Partially cloudy",Partly cloudy throughout the day with rain clearing later.,rain,"96741099999,WIII,WIHH,96739099999,96749099999,96751099999,96749599999,96745099999"
"-6.2155, 106.803",1/2/2022,32.7,25,28.1,37.8,25,30.8,23.9,79.2,0,0,0,,0,0,30.6,22.7,263.4,1009.2,47.6,6.9,220.2,19,7,,2022-01-02T05:42:30,2022-01-02T18:10:54,0.98,Partially cloudy,Partly cloudy throughout the day.,partly-cloudy-day,"96741099999,WIII,96739099999,WIHH,96749099999,96751099999,96745099999,96749599999"
"-6.2155, 106.803",1/3/2022,34.3,23.7,28.7,38.3,23.7,31.3,22.8,72.2,0,0,0,,0,0,18.4,20.7,300.6,1008.9,42.2,6.7,283.9,24.5,9,,2022-01-03T05:43:00,2022-01-03T18:11:18,0,Partially cloudy,Partly cloudy throughout the day.,partly-cloudy-day,"96741099999,WIII,WIHH,96739099999,96749099999,96751099999,96749599999,96745099999"
"-6.2155, 106.803",1/4/2022,32.7,24,28.3,37.2,24,31.4,23.3,75.5,0,0,0,,0,0,18,16.2,335.7,1009.9,42.3,6.2,291.8,25.1,10,,2022-01-04T05:43:31,2022-01-04T18:11:42,0.05,Partially cloudy,Partly cloudy throughout the day.,partly-cloudy-day,"96741099999,WIII,96739099999,WIHH,96749099999,96751099999,96745099999,96749599999"
"-6.2155, 106.803",1/5/2022,32.7,25,28.7,38.5,25,32.3,24.1,77.4,26.499,100,4.17,rain,0,0,19.4,12.5,340.6,1009.8,46.7,5.4,255.1,22.1,8,,2022-01-05T05:44:01,2022-01-05T18:12:06,0.08,"Rain, Partially cloudy",Partly cloudy throughout the day with late afternoon rain.,rain,"96741099999,WIII,96739099999,WIHH,96749099999,96751099999,96745099999,96749599999"
"-6.2155, 106.803",1/6/2022,32,25,27.6,39.6,25,30.4,25,86.9,12.303,100,16.67,rain,0,0,27.4,16.6,303.5,1010.5,59.7,5.2,226.3,19.5,8,,2022-01-06T05:44:32,2022-01-06T18:12:29,0.11,"Rain, Partially cloudy",Partly cloudy throughout the day with rain.,rain,"96741099999,WIII,96739099999,WIHH,96749099999,96751099999,96745099999,96749599999"
"-6.2155, 106.803",1/7/2022,33.9,24.3,28,39.3,24.3,30.2,23.7,79.4,0.615,100,12.5,rain,0,0,31,17.6,246.7,1010.8,52,6.1,233.4,20.1,8,,2022-01-07T05:45:02,2022-01-07T18:12:51,0.15,"Rain, Partially cloudy",Partly cloudy throughout the day with rain.,rain,"96741099999,WIII,96739099999,WIHH,96749099999,96751099999,96745099999,96749599999"
"-6.2155, 106.803",1/8/2022,32,24.3,28.4,38.2,24.3,31.6,24.2,79.5,0.027,100,4.17,rain,0,0,23.8,20.9,295.3,1009.9,51.1,6,266.6,23.1,9,,2022-01-08T05:45:32,2022-01-08T18:13:12,0.18,"Rain, Partially cloudy",Partly cloudy throughout the day with early morning rain.,rain,"96741099999,WIII,96739099999,WIHH,96749099999,96751099999,96745099999,96749599999"
"-6.2155, 106.803",1/9/2022,31.8,25.3,28.7,38.2,25.3,32.7,24.4,78.1,0,0,0,,0,0,30.6,25.2,282,1009.1,51.1,6.3,218.9,18.9,8,,2022-01-09T05:46:01,2022-01-09T18:13:33,0.21,Partially cloudy,Partly cloudy throughout the day.,partly-cloudy-day,"96741099999,WIII,96739099999,WIHH,96749099999,96751099999,96745099999,96749599999"
"-6.2155, 106.803",1/10/2022,31.5,25.3,27.9,38.5,25.3,31.1,24.6,82.8,11.327,100,8.33,rain,0,0,30.6,19.8,293.9,1009.2,53.7,6.2,235.5,20.2,8,10,2022-01-10T05:46:30,2022-01-10T18:13:53,0.25,"Rain, Partially cloudy",Partly cloudy throughout the day with late afternoon rain.,rain,"96741099999,WIII,96739099999,WIHH,96749099999,96751099999,96745099999,96749599999"
"-6.2155, 106.803",1/11/2022,31.5,24,26.6,38.5,24,28.4,24.4,88.8,59.072,100,25,rain,0,0,36.4,17.2,273.2,1011,68.3,5.5,143.7,12.4,6,10,2022-01-11T05:46:59,2022-01-11T18:14:12,0.28,"Rain, Partially cloudy",Partly cloudy throughout the day with a chance of rain throughout the day.,rain,"96737099999,96741099999,WIII,WIHH,96739099999,96749099999,96751099999,96749599999,96745099999"
"-6.2155, 106.803",1/12/2022,30.9,24,26.5,36.9,24,28.7,24.2,88.2,18.528,100,16.67,rain,0,0,51.8,21.7,292.6,1011,64.2,5.8,205,17.6,7,10,2022-01-12T05:47:28,2022-01-12T18:14:30,0.31,"Rain, Partially cloudy",Partly cloudy throughout the day with rain.,rain,"96741099999,WIII,96739099999,WIHH,96749099999,96751099999,96745099999,96749599999"
"-6.2155, 106.803",1/13/2022,30.7,24,27,36.5,24,30.1,24.3,85.5,2.249,100,16.67,rain,0,0,27.4,24.1,311.9,1010.9,55.1,6.3,130.6,11.3,6,30,2022-01-13T05:47:56,2022-01-13T18:14:48,0.34,"Rain, Partially cloudy",Partly cloudy throughout the day with rain.,rain,"96741099999,WIII,WIHH,96739099999,96749099999,96751099999,96749599999,96745099999"
"-6.2155, 106.803",1/14/2022,29,24,26.8,34.5,24,29.5,24.4,87.1,14.158,100,12.5,rain,0,0,28.8,19.4,303.2,1010.8,56.9,5.6,224.4,19.4,8,30,2022-01-14T05:48:23,2022-01-14T18:15:04,0.38,"Rain, Partially cloudy",Partly cloudy throughout the day with rain.,rain,"96741099999,WIII,96739099999,WIHH,96749099999,96751099999,96745099999,96749599999"
"-6.2155, 106.803",1/15/2022,29,24,26.9,34.1,24,29.7,24.5,87.3,3.928,100,8.33,rain,0,0,30.2,16.6,291.9,1010.6,64,5.8,167.9,14.5,6,30,2022-01-15T05:48:51,2022-01-15T18:15:20,0.41,"Rain, Partially cloudy",Partly cloudy throughout the day with early morning rain.,rain,"96741099999,WIII,WIHH,96739099999,96749099999,96751099999,96749599999,96745099999"
"-6.2155, 106.803",1/16/2022,29,25,27.1,34.8,25,30.1,25.3,90.1,10.801,100,8.33,rain,0,0,27.7,14.1,303.9,1010.1,52.5,4.9,206.1,17.6,7,30,2022-01-16T05:49:17,2022-01-16T18:15:35,0.44,"Rain, Partially cloudy",Partly cloudy throughout the day with rain in the morning and afternoon.,rain,"96741099999,WIII,96739099999,WIHH,96749099999,96751099999,96745099999,96749599999"
"-6.2155, 106.803",1/17/2022,31,25,27.8,37.7,25,31.4,24.9,85,8.233,100,16.67,rain,0,0,29.9,21.1,305.4,1009.7,64,6,235.3,20.3,9,30,2022-01-17T05:49:44,2022-01-17T18:15:49,0.47,"Rain, Partially cloudy",Partly cloudy throughout the day with rain.,rain,"96741099999,WIII,WIHH,96739099999,96749099999,96751099999,96749599999,96745099999"
"-6.2155, 106.803",1/18/2022,28.2,24,26.1,33,24,27.3,24.7,92.1,148.985,100,29.17,rain,0,0,40.7,18.7,304.9,1009.5,71.9,5.1,160.2,13.8,5,30,2022-01-18T05:50:10,2022-01-18T18:16:03,0.5,"Rain, Partially cloudy",Partly cloudy throughout the day with a chance of rain throughout the day.,rain,"96737099999,96741099999,WIII,WIHH,96739099999,96749099999,96751099999,96745099999,96749599999"
"-6.2155, 106.803",1/19/2022,30.5,24,27,36.4,24,29.4,24.2,85.5,56.288,100,25,rain,0,0,55.4,27.7,292.1,1008.7,70.1,6,235.2,20.2,8,10,2022-01-19T05:50:35,2022-01-19T18:16:15,0.54,"Rain, Partially cloudy",Partly cloudy throughout the day with a chance of rain throughout the day.,rain,"96741099999,WIII,WIHH,96739099999,96749099999,96751099999,96749599999,96745099999"
"-6.2155, 106.803",1/20/2022,29.7,24,25.8,34.3,24,26.5,23.4,87.1,1.203,100,16.67,rain,0,0,31.3,14.9,249.5,1009.6,57.6,6.3,84.3,7.2,4,10,2022-01-20T05:51:00,2022-01-20T18:16:27,0.58,"Rain, Partially cloudy",Partly cloudy throughout the day with a chance of rain throughout the day.,rain,"96741099999,WIII,96739099999,WIHH,96749099999,96751099999,96745099999,96749599999"
"-6.2155, 106.803",1/21/2022,31,24,27.3,36.3,24,30.1,23.9,82.2,0.648,100,8.33,rain,0,0,33.5,20,283.5,1009.3,52.1,6.4,238.4,20.6,8,30,2022-01-21T05:51:24,2022-01-21T18:16:37,0.61,"Rain, Partially cloudy",Partly cloudy throughout the day with afternoon rain.,rain,"96741099999,WIII,96739099999,WIHH,96749099999,96751099999,96745099999,96749599999"
"-6.2155, 106.803",1/22/2022,30.7,24,27.1,36.5,24,29.8,24.3,85,11.577,100,16.67,rain,0,0,21.2,16.6,278.3,1009.5,56.7,5.9,97.3,8.4,6,10,2022-01-22T05:51:47,2022-01-22T18:16:47,0.65,"Rain, Partially cloudy",Partly cloudy throughout the day with rain clearing later.,rain,"96741099999,WIII,96739099999,WIHH,96749099999,96751099999,96745099999,96749599999"
"-6.2155, 106.803",1/23/2022,33.2,25,28.9,40.6,25,32.5,24.1,76.2,0,0,0,,0,0,27.7,22.7,274.7,1008.5,45.8,6.6,237.4,20.6,8,30,2022-01-23T05:52:10,2022-01-23T18:16:55,0.68,Partially cloudy,Partly cloudy throughout the day.,partly-cloudy-day,"96741099999,WIII,WIHH,96739099999,96749099999,96751099999,96749599999,96745099999"
"-6.2155, 106.803",1/24/2022,34.5,25,29.1,41.2,25,32.7,23.8,74.5,0,0,0,,0,0,36.4,28.7,251.1,1007.5,43.1,6.9,270.8,23.4,9,30,2022-01-24T05:52:33,2022-01-24T18:17:03,0.72,Partially cloudy,Partly cloudy throughout the day.,partly-cloudy-day,"96741099999,WIII,96739099999,WIHH,96749099999,96751099999,96745099999,96749599999"
"-6.2155, 106.803",1/25/2022,31.7,25,28.6,38.2,25,32.7,24.5,79,4.326,100,8.33,rain,0,0,35.3,25.4,266.3,1007.7,48.4,7.4,207.8,17.9,7,30,2022-01-25T05:52:54,2022-01-25T18:17:10,0.75,"Rain, Partially cloudy",Partly cloudy throughout the day with rain.,rain,"96741099999,WIII,96739099999,WIHH,96749099999,96751099999,96745099999,96749599999"
"-6.2155, 106.803",1/26/2022,30,24.7,27.2,36.5,24.7,29.8,24.8,87,1.09,100,12.5,rain,0,0,28.4,13,279,1008.7,59.4,6.3,186.9,16.1,7,30,2022-01-26T05:53:15,2022-01-26T18:17:16,0.79,"Rain, Partially cloudy",Partly cloudy throughout the day with rain.,rain,"96741099999,WIII,96739099999,WIHH,96749099999,96751099999,96745099999,96749599999"
"-6.2155, 106.803",1/27/2022,32.5,24.3,28.2,37.2,24.3,31.5,24.2,80.3,0.051,100,4.17,rain,0,0,31.7,20.3,305.7,1009.1,48.2,6.4,248.2,21.6,9,10,2022-01-27T05:53:36,2022-01-27T18:17:21,0.82,"Rain, Partially cloudy",Partly cloudy throughout the day with late afternoon rain.,rain,"96741099999,WIII,WIHH,96739099999,96749099999,96751099999,96749599999,96745099999"
"-6.2155, 106.803",1/28/2022,32.7,25,27.5,39.5,25,29.8,24.2,83.2,4.75,100,12.5,rain,0,0,30.2,16.9,272.1,1009.6,48.6,6,229.5,19.9,9,10,2022-01-28T05:53:56,2022-01-28T18:17:25,0.86,"Rain, Partially cloudy",Partly cloudy throughout the day with rain.,rain,"96741099999,WIII,96739099999,WIHH,96749099999,96751099999,96745099999,96749599999"
"-6.2155, 106.803",1/29/2022,31.7,24.3,27.8,37.9,24.3,30.7,24.1,81.2,0,0,0,,0,0,23,17.2,320.3,1009.5,45.5,5.4,199,17.4,7,30,2022-01-29T05:54:15,2022-01-29T18:17:28,0.89,Partially cloudy,Partly cloudy throughout the day.,partly-cloudy-day,"96741099999,WIII,96739099999,WIHH,96749099999,96751099999,96745099999,96749599999"
"-6.2155, 106.803",1/30/2022,31.7,25,28,38.2,25,31.4,24.1,80,0.011,100,4.17,rain,0,0,23.4,16,289.2,1009.1,50,5.1,245.1,21.2,9,30,2022-01-30T05:54:33,2022-01-30T18:17:30,0.93,"Rain, Partially cloudy",Partly cloudy throughout the day with afternoon rain.,rain,"96741099999,WIII,96739099999,WIHH,96749099999,96751099999,96745099999,96749599999"
"-6.2155, 106.803",1/31/2022,31.7,25,28.3,38.8,25,31.8,23.9,77.6,0,0,0,rain,0,0,29.5,16.6,315.5,1009,52.6,5.9,201.1,17.4,8,30,2022-01-31T05:54:51,2022-01-31T18:17:31,0.96,Partially cloudy,Partly cloudy throughout the day.,partly-cloudy-day,"96741099999,WIII,96739099999,WIHH,96749099999,96751099999,96745099999,96749599999"
"-6.2155, 106.803",2/1/2022,31.7,25.3,28.3,38.2,25.3,32,24.6,81.2,0.026,100,4.17,rain,0,0,23.8,16.2,317.7,1008.5,52.6,5.9,281,24.3,9,30,2022-02-01T05:55:08,2022-02-01T18:17:31,0,"Rain, Partially cloudy",Partly cloudy throughout the day with afternoon rain.,rain,"96741099999,WIII,96739099999,WIHH,96749099999,96751099999,96745099999,96749599999"
"-6.2155, 106.803",2/2/2022,31.5,24,27.6,37.2,24,30.6,24.1,82.5,5.79,100,16.67,rain,0,0,24.1,22.3,334.1,1009.6,60.7,6.4,212.3,18.3,7,10,2022-02-02T05:55:24,2022-02-02T18:17:30,0.03,"Rain, Partially cloudy",Partly cloudy throughout the day with a chance of rain throughout the day.,rain,"96741099999,WIII,96739099999,WIHH,96749099999,96751099999,96745099999,96749599999"
"-6.2155, 106.803",2/3/2022,32.2,25.3,28.7,37.7,25.3,32.4,24.5,79,1.325,100,16.67,rain,0,0,21.6,15.2,341.5,1009,44.6,6.1,188,16.3,6,30,2022-02-03T05:55:40,2022-02-03T18:17:29,0.06,"Rain, Partially cloudy",Partly cloudy throughout the day with rain.,rain,"96741099999,WIII,96739099999,WIHH,96749099999,96751099999,96745099999,96749599999"
"-6.2155, 106.803",2/4/2022,31,24,26.9,37.4,24,29.2,24.3,86.9,91.594,100,20.83,rain,0,0,27.4,18.5,292.9,1008.3,66.2,5.4,246.7,21.5,9,30,2022-02-04T05:55:54,2022-02-04T18:17:26,0.1,"Rain, Partially cloudy",Partly cloudy throughout the day with a chance of rain throughout the day.,rain,"96741099999,WIII,96739099999,WIHH,96749099999,96751099999,96745099999,96749599999"
"-6.2155, 106.803",2/5/2022,29,24,26.2,34.5,24,27.8,24.3,89.7,43.013,100,16.67,rain,0,0,29.9,20.5,255.2,1008.7,60.7,6,130.7,11.2,6,10,2022-02-05T05:56:09,2022-02-05T18:17:22,0.13,"Rain, Partially cloudy",Partly cloudy throughout the day with a chance of rain throughout the day.,rain,"96741099999,WIII,96739099999,WIHH,96749099999,96751099999,96745099999,96749599999"
"-6.2155, 106.803",2/6/2022,30.9,24.7,27.5,36.3,24.7,30.3,24.2,82.6,0.675,100,20.83,rain,0,0,50.4,22,284.4,1008,58.7,6.3,184.4,15.9,7,10,2022-02-06T05:56:22,2022-02-06T18:17:18,0.16,"Rain, Partially cloudy",Partly cloudy throughout the day with a chance of rain throughout the day.,rain,"96741099999,WIII,96739099999,WIHH,96749099999,96751099999,96745099999,96749599999"
"-6.2155, 106.803",2/7/2022,31,25,27.7,36.5,25,30.4,24.5,83.7,11.841,100,16.67,rain,0,0,31,17.9,331.3,1008.3,61.9,6,193,16.7,7,10,2022-02-07T05:56:35,2022-02-07T18:17:13,0.19,"Rain, Partially cloudy",Partly cloudy throughout the day with rain clearing later.,rain,"96741099999,WIII,96739099999,WIHH,96749099999,96751099999,96745099999,96749599999"
"-6.2155, 106.803",2/8/2022,27.7,25.2,26.4,31.8,25.2,27.7,25,91.9,60.393,100,25,rain,0,0,29.2,10.3,153.3,1009.2,67.9,5.2,195.4,16.9,7,30,2022-02-08T05:56:47,2022-02-08T18:17:06,0.25,"Rain, Partially cloudy",Partly cloudy throughout the day with a chance of rain throughout the day.,rain,"96741099999,WIII,96739099999,WIHH,96749099999,96751099999,96745099999,96749599999"
"-6.2155, 106.803",2/9/2022,31,24.9,27.3,37.7,24.9,29.5,24.1,83.3,2.862,100,16.67,rain,0,0,68.4,37.1,276.2,1009.3,60.8,5.9,226,19.6,8,10,2022-02-09T05:56:58,2022-02-09T18:16:59,0.26,"Rain, Partially cloudy",Partly cloudy throughout the day with rain.,rain,"96741099999,WIII,96739099999,WIHH,96749099999,96751099999,96745099999,96749599999"
"-6.2155, 106.803",2/10/2022,30.4,24,27.1,34.7,24,29.3,23.3,80.8,0.055,100,8.33,rain,0,0,44.6,22.3,257.1,1008.2,60.6,6.3,128.5,11.1,5,10,2022-02-10T05:57:09,2022-02-10T18:16:51,0.29,"Rain, Partially cloudy",Partly cloudy throughout the day with early morning rain.,rain,"96737099999,96741099999,WIII,96739099999,WIHH,96749099999,96751099999,96745099999,96749599999"
"-6.2155, 106.803",2/11/2022,30,24,27.5,36.2,24,30.6,24,81.2,0.331,100,4.17,rain,0,0,35.3,18.4,275.7,1007.6,55.1,6,269.3,23.2,9,10,2022-02-11T05:57:19,2022-02-11T18:16:42,0.32,"Rain, Partially cloudy",Partly cloudy throughout the day with late afternoon rain.,rain,"96741099999,WIII,96739099999,WIHH,96749099999,96751099999,96745099999,96749599999"
"-6.2155, 106.803",2/12/2022,30,25.3,27.9,36.5,25.3,31.6,24.6,83,0,0,0,,0,0,31.3,13,290.5,1006.7,57.2,5.8,205.4,17.7,9,10,2022-02-12T05:57:28,2022-02-12T18:16:32,0.35,Partially cloudy,Partly cloudy throughout the day.,partly-cloudy-day,"96741099999,WIII,96739099999,WIHH,96749099999,96751099999,96745099999,96749599999"
"-6.2155, 106.803",2/13/2022,30.5,24.3,27,37,24.3,29.4,24.3,85.4,0.053,100,8.33,rain,0,0,28.1,17.7,293.1,1006.6,58.8,5.6,183.5,15.9,9,10,2022-02-13T05:57:36,2022-02-13T18:16:22,0.39,"Rain, Partially cloudy",Partly cloudy throughout the day with rain.,rain,"96741099999,WIII,96739099999,WIHH,96749099999,96751099999,96745099999,96749599999"
"-6.2155, 106.803",2/14/2022,29.7,24.3,26.4,34.7,24.3,27.7,23.7,85.9,21.241,100,12.5,rain,0,0,21.6,17.9,230.6,1008,51.2,5.6,190.9,16.4,8,10,2022-02-14T05:57:44,2022-02-14T18:16:10,0.42,"Rain, Partially cloudy",Partly cloudy throughout the day with rain in the morning and afternoon.,rain,"96741099999,WIII,96739099999,WIHH,96749099999,96751099999,96745099999,96749599999"
"-6.2155, 106.803",2/15/2022,33.5,24.8,27.5,39.3,24.8,30,24.1,82.6,2.96,100,4.17,rain,0,0,20.9,16.1,335.9,1007.9,53.2,5.6,199.5,17.2,7,10,2022-02-15T05:57:51,2022-02-15T18:15:58,0.45,"Rain, Partially cloudy",Partly cloudy throughout the day with late afternoon rain.,rain,"96741099999,WIII,96739099999,WIHH,96749099999,96751099999,96745099999,96749599999"
"-6.2155, 106.803",2/16/2022,32.7,24.3,28.1,38.9,24.3,30.7,24,80,41.699,100,8.33,rain,0,0,23.4,33.5,23.4,1006.4,53.6,5.6,257.4,22.2,9,30,2022-02-16T05:57:58,2022-02-16T18:15:45,0.5,"Rain, Partially cloudy",Partly cloudy throughout the day with late afternoon rain.,rain,"96741099999,WIII,96739099999,WIHH,96749099999,96751099999,96745099999,96749599999"
"-6.2155, 106.803",2/17/2022,30.7,24,27.3,37.4,24,30.2,24.3,83.8,0.255,100,12.5,rain,0,0,28.1,14.3,266.5,1006.7,55.1,5.7,208.9,18.2,7,10,2022-02-17T05:58:04,2022-02-17T18:15:31,0.52,"Rain, Partially cloudy",Partly cloudy throughout the day with rain.,rain,"96741099999,WIII,96739099999,WIHH,96749099999,96751099999,96745099999,96749599999"
"-6.2155, 106.803",2/18/2022,29.7,25.3,27.2,35.6,25.3,29.8,24.7,86.6,3.041,100,20.83,rain,0,0,20.2,10.6,7.9,1008.5,57.7,4.9,99.1,8.6,4,10,2022-02-18T05:58:09,2022-02-18T18:15:17,0.55,"Rain, Partially cloudy",Partly cloudy throughout the day with rain.,rain,"96741099999,WIII,96739099999,WIHH,96749099999,96751099999,96745099999,96749599999"
"-6.2155, 106.803",2/19/2022,30.9,25,27.3,37,25,30.2,24.5,85.5,1.989,100,12.5,rain,0,0,22.3,18.4,343.1,1009.4,52.5,5.6,239.5,20.7,8,30,2022-02-19T05:58:13,2022-02-19T18:15:02,0.59,"Rain, Partially cloudy",Partly cloudy throughout the day with rain.,rain,"96741099999,WIII,96739099999,WIHH,96749099999,96751099999,96745099999,96749599999"
"-6.2155, 106.803",2/20/2022,30,25.3,27.6,36.5,25.3,31,24.8,85.2,1.309,100,12.5,rain,0,0,24.8,17.4,305.9,1009.6,55.1,5.6,204,17.4,8,30,2022-02-20T05:58:17,2022-02-20T18:14:46,0.62,"Rain, Partially cloudy",Partly cloudy throughout the day with rain.,rain,"96741099999,WIII,96739099999,WIHH,96749099999,96751099999,96745099999,96749599999"
"-6.2155, 106.803",2/21/2022,32.7,24,28.2,38.6,24,31.2,23.6,77.3,0.117,100,8.33,rain,0,0,24.1,17.5,315.1,1009.2,55.5,6.1,236.1,20.2,9,30,2022-02-21T05:58:21,2022-02-21T18:14:29,0.66,"Rain, Partially cloudy",Partly cloudy throughout the day with rain clearing later.,rain,"96741099999,WIII,96739099999,WIHH,96749099999,96751099999,96745099999,96749599999"
"-6.2155, 106.803",2/22/2022,33.6,24,28.8,39.1,24,32.3,23.8,75.9,3.04,100,4.17,rain,0,0,30.2,19.4,284.3,1009.8,50.9,6.6,255.4,21.9,9,30,2022-02-22T05:58:23,2022-02-22T18:14:11,0.7,"Rain, Partially cloudy",Partly cloudy throughout the day with early morning rain.,rain,"96741099999,WIII,96739099999,WIHH,96749099999,96751099999,96745099999,96749599999"
"-6.2155, 106.803",2/23/2022,31.7,24,27.8,37.7,24,30.7,23.5,78.3,14.192,100,12.5,rain,0,0,31.3,29.5,282,1010.4,55.8,6.3,200.6,17.2,7,30,2022-02-23T05:58:25,2022-02-23T18:13:53,0.73,"Rain, Partially cloudy",Partly cloudy throughout the day with rain.,rain,"96741099999,WIII,96739099999,WIHH,96749099999,96751099999,96745099999,96749599999"
"-6.2155, 106.803",2/24/2022,32.5,23,27.7,35.6,23,29.5,22.1,73.7,3.302,100,12.5,rain,0,0,35.3,28.3,253,1010.4,52.5,6.8,139.2,12.1,6,10,2022-02-24T05:58:27,2022-02-24T18:13:35,0.75,"Rain, Partially cloudy",Partly cloudy throughout the day with rain clearing later.,rain,"96741099999,WIII,96739099999,WIHH,96749099999,96751099999,96745099999,96749599999"
"-6.2155, 106.803",2/25/2022,29.7,24,26.7,33.3,24,28.1,23,80.6,3.265,100,12.5,rain,0,0,31.7,21.3,247.2,1010.3,58.7,6.4,118.7,10.3,5,10,2022-02-25T05:58:28,2022-02-25T18:13:15,0.8,"Rain, Partially cloudy",Partly cloudy throughout the day with rain in the morning and afternoon.,rain,"96741099999,WIII,96739099999,WIHH,96749099999,96751099999,96745099999,96749599999"
"-6.2155, 106.803",2/26/2022,31,24.8,26.8,35.7,24.8,28.5,23.4,82,0.559,100,12.5,rain,0,0,61.2,30.2,252.2,1009.8,55.2,6.6,160.1,13.9,7,10,2022-02-26T05:58:28,2022-02-26T18:12:55,0.84,"Rain, Partially cloudy",Partly cloudy throughout the day with rain.,rain,"96741099999,WIII,96739099999,WIHH,96749099999,96751099999,96745099999,96749599999"
"-6.2155, 106.803",2/27/2022,30.5,24,27,35.8,24,29,23.7,82.7,2.285,100,8.33,rain,0,0,43.6,27.7,261.9,1009.6,44.8,6.8,212.2,18.4,8,10,2022-02-27T05:58:28,2022-02-27T18:12:35,0.87,"Rain, Partially cloudy",Partly cloudy throughout the day with rain in the morning and afternoon.,rain,"96737099999,96741099999,WIII,96739099999,WIHH,96749099999,96751099999,96745099999,96749599999"
"-6.2155, 106.803",2/28/2022,30.1,25,27.5,35.1,25,30.1,24.1,82.6,3.773,100,20.83,rain,0,0,38.2,23.5,262.9,1008.9,53.4,6.7,220.2,19.1,9,10,2022-02-28T05:58:27,2022-02-28T18:12:14,0.91,"Rain, Partially cloudy",Partly cloudy throughout the day with rain.,rain,"96741099999,WIII,96739099999,WIHH,96749099999,96751099999,96745099999,96749599999"
"-6.2155, 106.803",3/1/2022,29,23.3,25.9,33.6,23.3,27.2,23.9,89.3,16.185,100,29.17,rain,0,0,40.3,24.1,257.3,1009.4,65.4,5.7,185.3,16.2,8,10,2022-03-01T05:58:26,2022-03-01T18:11:52,0.95,"Rain, Partially cloudy",Partly cloudy throughout the day with a chance of rain throughout the day.,rain,"96741099999,WIII,96739099999,WIHH,96749099999,96751099999,96745099999,96749599999"
"-6.2155, 106.803",3/2/2022,31,24,27.3,37.7,24,29.9,24.2,83.8,7.307,100,8.33,rain,0,0,57.6,27.4,264.2,1008.9,50,6.6,197,17.2,6,10,2022-03-02T05:58:25,2022-03-02T18:11:30,0.98,"Rain, Partially cloudy",Partly cloudy throughout the day with afternoon rain.,rain,"96741099999,WIII,96739099999,WIHH,96749099999,96751099999,96745099999,96749599999"
"-6.2155, 106.803",3/3/2022,32.7,24,28.2,39.2,24,31.5,23.9,78.6,0.045,100,8.33,rain,0,0,34.2,27.7,276.6,1008.3,47.9,7,243.1,20.9,9,30,2022-03-03T05:58:23,2022-03-03T18:11:07,0,"Rain, Partially cloudy",Partly cloudy throughout the day with early morning rain.,rain,"96741099999,WIII,96739099999,WIHH,96749099999,96751099999,96745099999,96749599999"
"-6.2155, 106.803",3/4/2022,31.7,24,27.9,37,24,31,24,80.2,3.459,100,8.33,rain,0,0,35.3,17.4,274,1009.3,62.2,6.3,111.5,9.7,4,30,2022-03-04T05:58:20,2022-03-04T18:10:44,0.05,"Rain, Partially cloudy",Partly cloudy throughout the day with rain clearing later.,rain,"96741099999,WIII,96739099999,WIHH,96749099999,96751099999,96745099999,96749599999"
"-6.2155, 106.803",3/5/2022,32.7,24,27.2,38.3,24,29.4,23.8,82.3,12.982,100,12.5,rain,0,0,66.6,28.6,241.5,1008.9,53.6,6.3,201.3,17.4,9,30,2022-03-05T05:58:17,2022-03-05T18:10:20,0.08,"Rain, Partially cloudy",Partly cloudy throughout the day with rain.,rain,"96737099999,96741099999,WIII,96739099999,WIHH,96749099999,96751099999,96745099999,96749599999"
"-6.2155, 106.803",3/6/2022,31.7,25,27.4,37.9,25,29.8,23.9,81.8,0.916,100,12.5,rain,0,0,51.8,29.2,248.6,1008.7,60.7,6.5,203.8,17.7,8,30,2022-03-06T05:58:14,2022-03-06T18:09:56,0.11,"Rain, Partially cloudy",Partly cloudy throughout the day with rain.,rain,"96737099999,96741099999,WIII,96739099999,WIHH,96749099999,96751099999,96745099999,96749599999"
"-6.2155, 106.803",3/7/2022,32.5,26,28.5,38,26,31.1,23.3,74.5,0.011,100,8.33,rain,0,0,23.8,24.1,245.1,1008.3,55.5,7,183.8,15.9,8,30,2022-03-07T05:58:10,2022-03-07T18:09:31,0.14,"Rain, Partially cloudy",Partly cloudy throughout the day with rain.,rain,"96741099999,WIII,96739099999,WIHH,96749099999,96751099999,96745099999,96749599999"
"-6.2155, 106.803",3/8/2022,32.7,24.5,27.7,40.6,24.5,30.6,24.2,82.2,0.893,100,12.5,rain,0,0,37.1,20.5,251.4,1007.8,59.9,6.6,213.2,18.6,8,60,2022-03-08T05:58:06,2022-03-08T18:09:06,0.18,"Rain, Partially cloudy",Partly cloudy throughout the day with rain.,rain,"96741099999,WIII,96739099999,WIHH,96749099999,96751099999,96745099999,96749599999"
"-6.2155, 106.803",3/9/2022,31.7,25,27.5,37.9,25,29.9,24.5,84.2,0,0,0,rain,0,0,25.2,22.8,258.9,1007.8,50.3,6.4,227.1,19.7,9,30,2022-03-09T05:58:01,2022-03-09T18:08:41,0.21,Partially cloudy,Partly cloudy throughout the day.,partly-cloudy-day,"96741099999,WIII,96739099999,WIHH,96749099999,96751099999,96745099999,96749599999"
"-6.2155, 106.803",3/10/2022,32.3,25,28,39.2,25,31.1,24.4,81.7,0.75,100,12.5,rain,0,0,26.3,20.9,275.6,1007.2,47.9,6.2,254.2,21.9,9,30,2022-03-10T05:57:56,2022-03-10T18:08:15,0.25,"Rain, Partially cloudy",Partly cloudy throughout the day with rain.,rain,"96741099999,WIII,96739099999,WIHH,96749099999,96751099999,96745099999,96749599999"
"-6.2155, 106.803",3/11/2022,31.7,25.3,28,40.3,25.3,31.3,24.7,83.3,8.218,100,8.33,rain,0,0,28.1,30.4,270.7,1006.5,54.5,5.5,190.5,16.5,8,30,2022-03-11T05:57:51,2022-03-11T18:07:49,0.27,"Rain, Partially cloudy",Partly cloudy throughout the day with late afternoon rain.,rain,"96741099999,WIII,96739099999,WIHH,96749099999,96751099999,96745099999,96749599999"
"-6.2155, 106.803",3/12/2022,31.5,25,27.2,37.3,25,29.6,24.9,87.6,30.201,100,8.33,rain,0,0,36.7,16.6,262.5,1006.3,50.6,6.1,166.7,14.4,6,30,2022-03-12T05:57:46,2022-03-12T18:07:23,0.3,"Rain, Partially cloudy",Partly cloudy throughout the day with afternoon rain.,rain,"96737099999,96741099999,WIII,96739099999,WIHH,96749099999,96751099999,96745099999,96749599999"
"-6.2155, 106.803",3/13/2022,32,25,27.9,38.2,25,31,24.9,84.8,3.258,100,12.5,rain,0,0,30.2,15.7,307.9,1006.9,53.4,6.6,230,19.9,8,60,2022-03-13T05:57:40,2022-03-13T18:06:56,0.34,"Rain, Partially cloudy",Partly cloudy throughout the day with rain.,rain,"96741099999,WIII,96739099999,WIHH,96749099999,96751099999,96745099999,96749599999"
"-6.2155, 106.803",3/14/2022,33.7,26,28.6,41.3,26,32.9,25,82.1,5.332,100,16.67,rain,0,0,46.4,16.6,261.5,1007.3,52.1,5.9,234.3,20.3,9,60,2022-03-14T05:57:34,2022-03-14T18:06:29,0.37,"Rain, Partially cloudy",Partly cloudy throughout the day with rain.,rain,"96741099999,WIII,96739099999,WIHH,96749099999,96751099999,96745099999,96749599999"
"-6.2155, 106.803",3/15/2022,29.5,25,26.7,35.6,25,28.6,24.7,89.2,5.649,100,8.33,rain,0,0,18.4,19.8,241.3,1007,62.4,5.4,137.9,11.8,6,30,2022-03-15T05:57:27,2022-03-15T18:06:02,0.4,"Rain, Partially cloudy",Partly cloudy throughout the day with rain.,rain,"96741099999,WIII,96739099999,WIHH,96749099999,96751099999,96745099999,96749599999"
"-6.2155, 106.803",3/16/2022,33,24,28.3,39.6,24,31.9,24.2,80.1,0.103,100,4.17,rain,0,0,23.8,17.5,41.9,1006.8,46.5,5.5,265,23,9,30,2022-03-16T05:57:21,2022-03-16T18:05:35,0.43,"Rain, Partially cloudy",Partly cloudy throughout the day with afternoon rain.,rain,"96741099999,WIII,96739099999,WIHH,96749099999,96751099999,96745099999,96749599999"
"-6.2155, 106.803",3/17/2022,32.5,26,28.7,40.3,26,33.6,25.4,83.1,1.401,100,16.67,rain,0,0,24.5,18.4,270.8,1006.9,55.9,4.8,256.7,22.2,9,30,2022-03-17T05:57:14,2022-03-17T18:05:07,0.46,"Rain, Partially cloudy",Partly cloudy throughout the day with rain.,rain,"96741099999,WIII,96739099999,WIHH,96749099999,96751099999,96745099999,96749599999"
"-6.2155, 106.803",3/18/2022,32.7,25,28.2,40.6,25,32.2,25,83.1,0,0,0,rain,0,0,24.1,24.6,247.3,1006.9,50.8,5.5,250.7,21.7,9,60,2022-03-18T05:57:07,2022-03-18T18:04:40,0.5,Partially cloudy,Partly cloudy throughout the day.,partly-cloudy-day,"96741099999,WIII,96739099999,WIHH,96749099999,96751099999,96745099999,96749599999"
"-6.2155, 106.803",3/19/2022,33.7,25.7,29,40.3,25.7,33.1,24.2,76.2,0,0,0,rain,0,0,33.1,29.2,249.4,1006.9,47.7,7,249.4,21.6,8,30,2022-03-19T05:57:00,2022-03-19T18:04:12,0.53,Partially cloudy,Partly cloudy throughout the day.,partly-cloudy-day,"96741099999,WIII,96739099999,WIHH,96749099999,96751099999,96745099999,96749599999"
"-6.2155, 106.803",3/20/2022,34.8,25.5,29.3,40.3,25.5,32.9,23.3,71.1,0,0,0,,0,0,46.4,33.8,251.3,1007.9,43.5,7.2,242.2,21,9,30,2022-03-20T05:56:52,2022-03-20T18:03:44,0.57,Partially cloudy,Partly cloudy throughout the day.,partly-cloudy-day,"96741099999,WIII,96739099999,WIHH,96749099999,96751099999,96745099999,96749599999"
"-6.2155, 106.803",3/21/2022,33.2,26,29,38.5,26,32.4,23.5,73.2,0,0,0,,0,0,40.7,27.7,247.1,1008.8,46.5,7.3,254.6,22.2,9,10,2022-03-21T05:56:45,2022-03-21T18:03:16,0.6,Partially cloudy,Partly cloudy throughout the day.,partly-cloudy-day,"96741099999,WIII,96739099999,WIHH,96749099999,96751099999,96745099999,96749599999"
"-6.2155, 106.803",3/22/2022,32.7,25.3,28.6,39.2,25.3,32.5,24.1,77.1,1.657,100,4.17,rain,0,0,32.4,21.1,270.7,1009.1,45.6,6.7,233.2,20.2,9,10,2022-03-22T05:56:37,2022-03-22T18:02:48,0.64,"Rain, Partially cloudy",Partly cloudy throughout the day with afternoon rain.,rain,"96741099999,WIII,96739099999,WIHH,96749099999,96751099999,96745099999,96749599999"
"-6.2155, 106.803",3/23/2022,31.9,24.5,27.5,38.9,24.5,30.6,24.3,82.7,1.206,100,8.33,rain,0,0,57.6,26.5,250,1009.1,51.9,6.5,222.8,19.2,8,10,2022-03-23T05:56:30,2022-03-23T18:02:19,0.68,"Rain, Partially cloudy",Partly cloudy throughout the day with rain.,rain,"96741099999,WIII,96739099999,WIHH,96749099999,96751099999,96745099999,96749599999"
"-6.2155, 106.803",3/24/2022,32.7,24.3,28.6,38,24.3,31.9,23.9,77.2,4.149,100,8.33,rain,0,0,24.5,23.3,315.7,1008.6,45.6,6.2,258,22.3,9,30,2022-03-24T05:56:22,2022-03-24T18:01:51,0.71,"Rain, Partially cloudy",Partly cloudy throughout the day with rain in the morning and afternoon.,rain,"96737099999,96741099999,WIII,96739099999,WIHH,96749099999,96751099999,96745099999,96749599999"
"-6.2155, 106.803",3/25/2022,33,26,29,39.6,26,33.8,25,80,0.076,100,4.17,rain,0,0,22.7,19.4,42.4,1009.4,49.1,5.3,260.5,22.6,9,30,2022-03-25T05:56:14,2022-03-25T18:01:23,0.75,"Rain, Partially cloudy",Partly cloudy throughout the day with late afternoon rain.,rain,"96741099999,WIII,96739099999,WIHH,96749099999,96751099999,96745099999,96749599999"
"-6.2155, 106.803",3/26/2022,30,24.2,26.4,36.2,24.2,28.2,24.5,89.7,22.507,100,12.5,rain,0,0,40.7,11.3,247.8,1010.6,52.6,5,229.1,20,8,30,2022-03-26T05:56:06,2022-03-26T18:00:54,0.78,"Rain, Partially cloudy",Partly cloudy throughout the day with rain.,rain,"96741099999,WIII,96739099999,WIHH,96749099999,96751099999,96745099999,96749599999"
"-6.2155, 106.803",3/27/2022,32.5,24,27.4,38.2,24,30.3,24.5,85.5,10.552,100,12.5,rain,0,0,48.2,29.5,267.2,1009.8,56.7,5.3,213.9,18.5,8,30,2022-03-27T05:55:58,2022-03-27T18:00:26,0.82,"Rain, Partially cloudy",Partly cloudy throughout the day with rain.,rain,"96737099999,96741099999,WIII,96739099999,WIHH,96749099999,96751099999,96745099999,96749599999"
"-6.2155, 106.803",3/28/2022,32.7,24.3,27.9,39.2,24.3,31,24.4,82.5,8.205,100,12.5,rain,0,0,24.8,22.8,316.1,1009.3,56.2,5.9,251.8,21.7,10,30,2022-03-28T05:55:51,2022-03-28T17:59:58,0.85,"Rain, Partially cloudy",Partly cloudy throughout the day with rain.,rain,"96741099999,WIII,96739099999,WIHH,96749099999,96751099999,96745099999,96749599999"
"-6.2155, 106.803",3/29/2022,32.7,25.3,29,39.2,25.3,33.3,24.5,77.7,0,0,0,rain,0,0,24.8,13,282.5,1008.7,46,5.7,257.1,22.3,9,30,2022-03-29T05:55:43,2022-03-29T17:59:30,0.89,Partially cloudy,Partly cloudy throughout the day.,partly-cloudy-day,"96741099999,WIII,96739099999,WIHH,96749099999,96751099999,96745099999,96749599999"
"-6.2155, 106.803",3/30/2022,32.7,25.3,28.9,38.9,25.3,32.7,24,76,0,0,0,rain,0,0,19.8,11.6,293.2,1008.7,49.5,5.1,265.3,23,9,30,2022-03-30T05:55:35,2022-03-30T17:59:01,0.93,Partially cloudy,Partly cloudy throughout the day.,partly-cloudy-day,"96741099999,WIII,96739099999,WIHH,96749099999,96751099999,96745099999,96749599999"
"-6.2155, 106.803",3/31/2022,32.7,25,28.3,39,25,32,24.3,80,0.049,100,8.33,rain,0,0,24.1,18.1,253.5,1009.3,50.5,5.6,258.6,22.4,9,30,2022-03-31T05:55:27,2022-03-31T17:58:33,0.96,"Rain, Partially cloudy",Partly cloudy throughout the day with rain.,rain,"96741099999,WIII,96739099999,WIHH,96749099999,96751099999,96745099999,96749599999"
"-6.2155, 106.803",4/1/2022,31.2,25.3,28.3,37.2,25.3,32,24.4,79.9,3.345,100,8.33,rain,0,0,19.8,14.4,255.1,1009.7,60.8,6,195.3,16.9,7,30,2022-04-01T05:55:19,2022-04-01T17:58:06,0,"Rain, Partially cloudy",Partly cloudy throughout the day with rain.,rain,"96741099999,WIII,96739099999,WIHH,96749099999,96751099999,96745099999,96749599999"
"-6.2155, 106.803",4/2/2022,32.7,25.3,27.9,38.3,25.3,31.1,24.6,82.8,14.973,100,8.33,rain,0,0,25.9,19.2,267.7,1009.6,50.2,6.2,251.7,21.7,9,30,2022-04-02T05:55:11,2022-04-02T17:57:38,0.03,"Rain, Partially cloudy",Partly cloudy throughout the day with afternoon rain.,rain,"96741099999,WIII,96739099999,WIHH,96749099999,96751099999,96745099999,96749599999"
"-6.2155, 106.803",4/3/2022,33.5,25,27.1,39.3,25,28.8,24,84.4,24.054,100,16.67,rain,0,0,32.8,29.5,254.6,1010,57.1,6.7,196.9,16.9,7,30,2022-04-03T05:55:04,2022-04-03T17:57:10,0.06,"Rain, Partially cloudy",Partly cloudy throughout the day with rain.,rain,"96741099999,WIII,96739099999,WIHH,96749099999,96751099999,96745099999,96749599999"
"-6.2155, 106.803",4/4/2022,33,25,28.4,39.3,25,31.3,23.6,76.8,0.001,100,4.17,rain,0,0,40.7,19.8,272.5,1010.1,48.8,7.1,229.8,20,8,30,2022-04-04T05:54:56,2022-04-04T17:56:43,0.09,"Rain, Partially cloudy",Partly cloudy throughout the day with early morning rain.,rain,"96741099999,WIII,96739099999,WIHH,96749099999,96751099999,96745099999,96749599999"
"-6.2155, 106.803",4/5/2022,33.7,24.8,27.6,39.3,24.8,29.9,24.1,82.5,49.33,100,12.5,rain,0,0,44.6,22.3,213.6,1010.9,57.7,6,240.2,20.8,9,30,2022-04-05T05:54:49,2022-04-05T17:56:16,0.13,"Rain, Partially cloudy",Partly cloudy throughout the day with rain.,rain,"96741099999,WIII,96739099999,WIHH,96749099999,96751099999,96745099999,96749599999"
"-6.2155, 106.803",4/6/2022,34.1,24,28.6,42,24,31.7,23.6,76,0.409,100,16.67,rain,0,0,25.9,29.5,246.4,1010.2,46,7.5,226.5,19.4,8,30,2022-04-06T05:54:42,2022-04-06T17:55:49,0.16,"Rain, Partially cloudy",Partly cloudy throughout the day with rain.,rain,"96741099999,WIII,96739099999,96749099999,96751099999,96745099999"
"-6.2155, 106.803",4/7/2022,33.1,25,28.7,42.1,25,32.5,24.2,77.5,0.056,100,4.17,rain,0,0,23.8,24.1,262.8,1009.8,46.8,7.5,263.8,23,9,30,2022-04-07T05:54:35,2022-04-07T17:55:22,0.19,"Rain, Partially cloudy",Partly cloudy throughout the day with late afternoon rain.,rain,"96741099999,WIII,96739099999,96749099999,96751099999,96745099999"
"-6.2155, 106.803",4/8/2022,33.1,26,28.1,39.3,26,30.7,23.6,77.5,42.163,100,16.67,rain,0,0,25.9,29.5,239.4,1009.6,48.3,7.2,232.5,19.8,8,10,2022-04-08T05:54:28,2022-04-08T17:54:56,0.22,"Rain, Partially cloudy",Partly cloudy throughout the day with rain.,rain,"96741099999,WIII,96739099999,96749099999,96751099999,96745099999"
"-6.2155, 106.803",4/9/2022,33,24,28.5,38.1,24,31.4,23.7,76.7,0.329,100,16.67,rain,0,0,20.5,14.8,273.1,1009,46.5,7.2,263.1,22.5,10,30,2022-04-09T05:54:21,2022-04-09T17:54:29,0.25,"Rain, Partially cloudy",Partly cloudy throughout the day with rain.,rain,"96741099999,WIII,96739099999,96749099999,96751099999,96745099999"
"-6.2155, 106.803",4/10/2022,32.9,25,28.4,39.1,25,31.8,24.2,79.2,0.053,100,16.67,rain,0,0,18.7,18.4,260.8,1009.1,46.6,6.4,226.6,19.3,8,30,2022-04-10T05:54:15,2022-04-10T17:54:03,0.29,"Rain, Partially cloudy",Partly cloudy throughout the day with rain.,rain,"96741099999,WIII,96739099999,96749099999,96751099999,96745099999"
"-6.2155, 106.803",4/11/2022,32.2,25.5,28.5,37.9,25.5,31.9,24.2,78.8,25.09,100,16.67,rain,0,0,19.8,18.4,292,1009.1,58.2,6.4,237.3,20.4,8,30,2022-04-11T05:54:09,2022-04-11T17:53:38,0.32,"Rain, Partially cloudy",Partly cloudy throughout the day with rain.,rain,"96741099999,WIII,96739099999,96749099999,96751099999,96745099999"
"-6.2155, 106.803",4/12/2022,33,25,28.1,39.3,25,31.3,24.7,83,3.106,100,20.83,rain,0,0,19.4,24.1,295.1,1008.5,58.4,5.1,236.5,20.3,8,10,2022-04-12T05:54:02,2022-04-12T17:53:13,0.35,"Rain, Partially cloudy",Partly cloudy throughout the day with a chance of rain throughout the day.,rain,"96737099999,96741099999,WIII,96739099999,96749099999,96751099999,96745099999"
"-6.2155, 106.803",4/13/2022,33,26,28.8,39.3,26,33,24.7,79.4,0.082,100,12.5,rain,0,0,20.9,14.8,305.2,1008,58.7,5.3,254.7,21.9,9,10,2022-04-13T05:53:57,2022-04-13T17:52:48,0.38,"Rain, Partially cloudy",Partly cloudy throughout the day with rain.,rain,"96741099999,WIII,96739099999,96749099999,96751099999,96745099999"
"-6.2155, 106.803",4/14/2022,33,25.4,29,39.3,25.4,32.8,24.2,76.1,0.377,100,12.5,rain,0,0,26.3,22.9,56.2,1008,43.2,6.9,257.6,22.3,9,30,2022-04-14T05:53:51,2022-04-14T17:52:23,0.42,"Rain, Partially cloudy",Partly cloudy throughout the day with rain.,rain,"96741099999,WIII,96739099999,96749099999,96751099999,96745099999"
"-6.2155, 106.803",4/15/2022,33.5,26,29.5,42.1,26,34.4,24.8,76.7,0.583,100,16.67,rain,0,0,21.2,20.5,50.4,1008.4,47.2,5.8,246.8,21.5,9,30,2022-04-15T05:53:46,2022-04-15T17:51:59,0.45,"Rain, Partially cloudy",Partly cloudy throughout the day with rain.,rain,"96741099999,WIII,96739099999,96749099999,96751099999,96745099999"
"-6.2155, 106.803",4/16/2022,34,26,29.2,40.6,26,33.2,24.2,75.7,1.032,100,4.17,rain,0,0,18.7,16.6,51.5,1008,46.5,6.4,259.4,22.2,9,30,2022-04-16T05:53:41,2022-04-16T17:51:36,0.48,"Rain, Partially cloudy",Partly cloudy throughout the day with late afternoon rain.,rain,"96741099999,WIII,96739099999,96749099999,96751099999,96745099999"
"-6.2155, 106.803",4/17/2022,33,25,29.4,41.8,25,34.6,25.1,78.7,0.372,100,16.67,rain,0,0,35.3,20.5,59,1007.2,47.8,6.1,253.5,21.8,9,30,2022-04-17T05:53:36,2022-04-17T17:51:12,0.5,"Rain, Partially cloudy",Partly cloudy throughout the day with rain.,rain,"96741099999,WIII,96739099999,96749099999,96751099999,96745099999"
"-6.2155, 106.803",4/18/2022,34,26,29.4,42.2,26,35.3,25.4,79.7,15.16,100,25,rain,0,0,21.6,20.5,78.2,1008.2,55.5,7.6,254.2,22.1,9,30,2022-04-18T05:53:32,2022-04-18T17:50:50,0.55,"Rain, Partially cloudy",Partly cloudy throughout the day with a chance of rain throughout the day.,rain,"96741099999,WIII,96739099999,96749099999,96751099999,96745099999"
"-6.2155, 106.803",4/19/2022,33,25,28.4,40.6,25,32.5,24.7,80.9,1.224,100,20.83,rain,0,0,35.3,22.3,284.4,1008.9,57.3,5.7,198,17.1,7,30,2022-04-19T05:53:28,2022-04-19T17:50:27,0.59,"Rain, Partially cloudy",Partly cloudy throughout the day with rain.,rain,"96741099999,WIII,96739099999,96749099999,96751099999,96745099999"
"-6.2155, 106.803",4/20/2022,33,25,28.5,40.7,25,32.3,24.6,80.3,3.344,100,4.17,rain,0,0,30.2,27.7,268.8,1008.4,55.1,6.4,183.8,15.9,7,30,2022-04-20T05:53:25,2022-04-20T17:50:05,0.62,"Rain, Partially cloudy",Partly cloudy throughout the day with afternoon rain.,rain,"96741099999,WIII,96739099999,96749099999,96751099999,96745099999"
"-6.2155, 106.803",4/21/2022,29,25,26.8,35.6,25,28.8,24.6,87.7,11.416,100,12.5,rain,0,0,26.6,16.6,232.4,1008.6,58.8,6.3,80,6.9,3,10,2022-04-21T05:53:21,2022-04-21T17:49:44,0.66,"Rain, Partially cloudy",Partly cloudy throughout the day with rain in the morning and afternoon.,rain,"96741099999,WIII,96739099999,96749099999,96751099999,96745099999"
"-6.2155, 106.803",4/22/2022,31,25,26.3,37.7,25,27.7,24.4,89.5,7.767,100,16.67,rain,0,0,33.5,16.6,133.2,1008.8,66.1,5,180.8,15.6,7,30,2022-04-22T05:53:18,2022-04-22T17:49:23,0.69,"Rain, Partially cloudy",Partly cloudy throughout the day with rain.,rain,"96741099999,WIII,96739099999,96749099999,96751099999,96745099999"
"-6.2155, 106.803",4/23/2022,32.8,25,28.3,40.4,25,32.3,24.8,82.4,0.089,100,12.5,rain,0,0,19.4,16.9,3.1,1008.2,46.2,6.3,221.8,19.2,8,30,2022-04-23T05:53:16,2022-04-23T17:49:03,0.75,"Rain, Partially cloudy",Partly cloudy throughout the day with rain.,rain,"96741099999,WIII,96739099999,96749099999,96751099999,96745099999"
"-6.2155, 106.803",4/24/2022,33,25,28.7,40.6,25,32.7,24.7,80.5,5.624,100,8.33,rain,0,0,24.5,18.5,301.7,1008.1,54.2,7,229.8,19.8,8,30,2022-04-24T05:53:14,2022-04-24T17:48:43,0.76,"Rain, Partially cloudy",Partly cloudy throughout the day with morning rain.,rain,"96741099999,WIII,96739099999,96749099999,96751099999,96745099999"
"-6.2155, 106.803",4/25/2022,34,24,28.5,40.6,24,31.7,24.5,80.8,21.858,100,12.5,rain,0,0,20.9,25.9,228.8,1007.2,57.6,5.9,260.7,22.7,9,60,2022-04-25T05:53:12,2022-04-25T17:48:24,0.8,"Rain, Partially cloudy",Partly cloudy throughout the day with rain.,rain,"96737099999,96741099999,WIII,96739099999,96749099999,96751099999,96745099999"
"-6.2155, 106.803",4/26/2022,33.5,25,28.5,40.7,25,32.2,24.6,80.6,2.74,100,4.17,rain,0,0,25.6,22.3,269.6,1006.9,47,7.1,229.6,19.9,8,30,2022-04-26T05:53:11,2022-04-26T17:48:05,0.83,"Rain, Partially cloudy",Partly cloudy throughout the day with early morning rain.,rain,"96737099999,96741099999,WIII,96739099999,96749099999,96751099999,96745099999"
"-6.2155, 106.803",4/27/2022,32,24,28.2,40.7,24,32.3,24.6,81.4,6.16,100,20.83,rain,0,0,57.6,31.7,336.1,1007.3,63.1,6.6,177.2,15.4,6,30,2022-04-27T05:53:10,2022-04-27T17:47:47,0.87,"Rain, Partially cloudy",Partly cloudy throughout the day with rain.,rain,"96741099999,WIII,96739099999,96749099999,96751099999,96745099999"
"-6.2155, 106.803",4/28/2022,32.3,24,27.5,39.1,24,30.6,24.3,83.8,3.204,100,8.33,rain,0,0,28.8,22.3,244.7,1007.9,64.1,7.5,88.5,7.6,4,30,2022-04-28T05:53:09,2022-04-28T17:47:29,0.91,"Rain, Partially cloudy",Partly cloudy throughout the day with early morning rain.,rain,"96741099999,WIII,96739099999,96749099999,96751099999,96745099999"
"-6.2155, 106.803",4/29/2022,34,25,28.7,42.1,25,33.1,24.7,80,0,0,0,,0,0,40.7,22.3,249.8,1007.5,51.1,8.2,202.3,17.5,7,30,2022-04-29T05:53:09,2022-04-29T17:47:13,0.94,Partially cloudy,Partly cloudy throughout the day.,partly-cloudy-day,"96741099999,WIII,96739099999,96749099999,96751099999,96745099999"
"-6.2155, 106.803",4/30/2022,31,26,27.9,40.6,26,32,25.3,85.8,0.08,100,12.5,rain,0,0,17.6,16.6,224.6,1007.4,51.1,6.6,162.5,14,6,30,2022-04-30T05:53:09,2022-04-30T17:46:56,0.98,"Rain, Partially cloudy",Partly cloudy throughout the day with rain.,rain,"96741099999,WIII,96739099999,96749099999,96751099999,96745099999"
"-6.2155, 106.803",5/1/2022,31.6,26,27.8,39.6,26,31.3,25.3,86.7,0.711,100,20.83,rain,0,0,19.8,11.2,354.4,1007.8,54.3,6,145.7,12.7,6,30,2022-05-01T05:53:10,2022-05-01T17:46:40,0,"Rain, Partially cloudy",Partly cloudy throughout the day with rain.,rain,"96741099999,WIII,96739099999,96749099999,96751099999,96745099999"
"-6.2155, 106.803",5/2/2022,32,24,27.6,40.7,24,30.8,24.9,86,22.603,100,12.5,rain,0,0,24.1,23.4,294,1008.3,59,6.2,200.8,17.3,8,30,2022-05-02T05:53:11,2022-05-02T17:46:25,0.04,"Rain, Partially cloudy",Partly cloudy throughout the day with rain.,rain,"96741099999,WIII,96739099999,96749099999,96751099999,96745099999"
"-6.2155, 106.803",5/3/2022,33,25,28.1,39.3,25,31.8,25,84.6,2.636,100,4.17,rain,0,0,30.2,20.5,103,1008.2,49.1,7,244.2,21.1,9,30,2022-05-03T05:53:13,2022-05-03T17:46:11,0.08,"Rain, Partially cloudy",Partly cloudy throughout the day with morning rain.,rain,"96741099999,WIII,96739099999,96749099999,96751099999,96745099999"
"-6.2155, 106.803",5/4/2022,33,26,28.4,40.6,26,32.3,25,82.7,0.08,100,12.5,rain,0,0,23.4,25.9,291,1008.8,54.5,7.1,212.7,18.5,8,30,2022-05-04T05:53:15,2022-05-04T17:45:57,0.11,"Rain, Partially cloudy",Partly cloudy throughout the day with rain.,rain,"96741099999,WIII,96739099999,96749099999,96751099999,96745099999"
"-6.2155, 106.803",5/5/2022,33.4,25,28.8,42.1,25,33.3,25.2,81.9,0.001,100,4.17,rain,0,0,38.9,27.7,90.6,1007.7,48.9,6.9,236.6,20.3,8,30,2022-05-05T05:53:18,2022-05-05T17:45:44,0.14,"Rain, Partially cloudy",Partly cloudy throughout the day with afternoon rain.,rain,"96741099999,WIII,96739099999,96749099999,96751099999,96745099999"
"-6.2155, 106.803",5/6/2022,34.4,26,29.5,42.1,26,35,25.4,79.9,0,0,0,rain,0,0,24.5,24.1,67,1007,45,7.2,229.6,19.8,8,30,2022-05-06T05:53:21,2022-05-06T17:45:32,0.17,Partially cloudy,Partly cloudy throughout the day.,partly-cloudy-day,"96741099999,WIII,96739099999,96749099999,96751099999,96745099999"
"-6.2155, 106.803",5/7/2022,32.9,26,29.3,40.9,26,34.4,25,78.7,0.031,100,12.5,rain,0,0,20.5,16.6,264.7,1007.5,54.3,7.5,248.5,21.5,8,30,2022-05-07T05:53:24,2022-05-07T17:45:20,0.21,"Rain, Partially cloudy",Partly cloudy throughout the day with rain.,rain,"96741099999,WIII,96739099999,96749099999,96751099999,96745099999"
"-6.2155, 106.803",5/8/2022,35,26,29.8,43.3,26,35.5,25.1,76.8,0,0,0,,0,0,24.1,20.5,268.5,1007.2,42.4,7.9,232.7,20.1,8,30,2022-05-08T05:53:28,2022-05-08T17:45:09,0.24,Partially cloudy,Partly cloudy throughout the day.,partly-cloudy-day,"96741099999,WIII,96739099999,96749099999,96751099999,96745099999"
"-6.2155, 106.803",5/9/2022,33.1,25,28.7,42.3,25,33.6,25.1,81.7,0.046,100,12.5,rain,0,0,23.4,22.3,97.5,1007.5,56.6,7.1,194.8,16.9,8,30,2022-05-09T05:53:32,2022-05-09T17:44:58,0.25,"Rain, Partially cloudy",Partly cloudy throughout the day with rain.,rain,"96741099999,WIII,96739099999,96749099999,96751099999,96745099999"
"-6.2155, 106.803",5/10/2022,33.3,26,29.7,41.3,26,35.6,25.4,78.4,0.002,100,8.33,rain,0,0,20.5,18.4,59.1,1007.4,48.7,7.2,205.1,17.9,8,60,2022-05-10T05:53:37,2022-05-10T17:44:48,0.31,"Rain, Partially cloudy",Partly cloudy throughout the day with rain.,rain,"96741099999,WIII,96739099999,96749099999,96751099999,96745099999"
"-6.2155, 106.803",5/11/2022,32.7,23,28.1,40.7,23,32.7,25.4,86.2,19.382,100,20.83,rain,0,0,22,46.4,295,1007.8,66.6,5.9,213.1,18.2,8,30,2022-05-11T05:53:42,2022-05-11T17:44:39,0.34,"Rain, Partially cloudy",Partly cloudy throughout the day with rain.,rain,"96741099999,WIII,96739099999,96749099999,96751099999,96745099999"
"-6.2155, 106.803",5/12/2022,32.7,26,28.6,40.7,26,33.7,25.5,84.3,13.341,100,12.5,rain,0,0,28.4,20.5,256.2,1008.6,54.5,6.5,196.3,17.1,7,60,2022-05-12T05:53:48,2022-05-12T17:44:31,0.37,"Rain, Partially cloudy",Partly cloudy throughout the day with rain.,rain,"96741099999,WIII,96739099999,96749099999,96751099999,96745099999"
"-6.2155, 106.803",5/13/2022,33,26,29,42.3,26,34.2,25.4,81.8,10.758,100,8.33,rain,0,0,26.3,16.6,283,1008.8,42.4,7.4,236.9,20.5,8,30,2022-05-13T05:53:54,2022-05-13T17:44:23,0.4,"Rain, Partially cloudy",Partly cloudy throughout the day with rain.,rain,"96737099999,96741099999,WIII,96739099999,96749099999,96751099999,96745099999"
"-6.2155, 106.803",5/14/2022,33,26,29.1,42.1,26,34.2,25.2,80,0.019,100,4.17,rain,0,0,19.4,14.8,81.9,1009.6,46.5,6.8,215.1,18.5,8,10,2022-05-14T05:54:01,2022-05-14T17:44:16,0.44,"Rain, Partially cloudy",Partly cloudy throughout the day with afternoon rain.,rain,"96741099999,WIII,96739099999,96749099999,96751099999,96745099999"
"-6.2155, 106.803",5/15/2022,33.3,25,28.7,43.8,25,34,25.9,85.5,7.23,100,16.67,rain,0,0,18,18.4,138.3,1010.3,53,5.3,200.1,17.2,8,60,2022-05-15T05:54:08,2022-05-15T17:44:10,0.47,"Rain, Partially cloudy",Partly cloudy throughout the day with rain.,rain,"96737099999,96741099999,WIII,96739099999,96749099999,96751099999,96745099999"
"-6.2155, 106.803",5/16/2022,34,25,28.2,43.5,25,31.6,25,83.7,0.303,100,12.5,rain,0,0,19.4,13,273.7,1009.8,46.5,6,225.9,19.6,9,30,2022-05-16T05:54:15,2022-05-16T17:44:04,0.5,"Rain, Partially cloudy",Partly cloudy throughout the day with rain.,rain,"96741099999,WIII,96739099999,96749099999,96751099999,96745099999"
"-6.2155, 106.803",5/17/2022,32.3,26,29,40.7,26,34.2,25.6,82.9,0.125,100,12.5,rain,0,0,21.2,19.7,286.2,1009.7,51.9,6.5,177.6,15.3,7,30,2022-05-17T05:54:23,2022-05-17T17:44:00,0.54,"Rain, Partially cloudy",Partly cloudy throughout the day with rain.,rain,"96741099999,WIII,96739099999,96749099999,96751099999,96745099999"
"-6.2155, 106.803",5/18/2022,33,26,28.5,42.1,26,32.8,25.2,83.5,31.415,100,12.5,rain,0,0,19.4,18.4,166,1010.4,53.7,6.4,206.4,17.8,8,30,2022-05-18T05:54:32,2022-05-18T17:43:55,0.57,"Rain, Partially cloudy",Partly cloudy throughout the day with rain.,rain,"96737099999,96741099999,WIII,96739099999,96749099999,96751099999,96745099999"
"-6.2155, 106.803",5/19/2022,31.8,25,27.5,39.7,25,30.6,25.2,87.8,9.643,100,20.83,rain,0,0,22,18.4,18.9,1010.9,54.9,4.9,213,18.3,8,30,2022-05-19T05:54:40,2022-05-19T17:43:52,0.61,"Rain, Partially cloudy",Partly cloudy throughout the day with rain.,rain,"96741099999,WIII,96739099999,96749099999,96751099999,96745099999"
"-6.2155, 106.803",5/20/2022,31.1,25,27.3,39.1,25,29.9,24.9,87.5,17.688,100,12.5,rain,0,0,20.2,14.8,51.9,1009.9,55.8,6.7,178.4,15.5,6,10,2022-05-20T05:54:50,2022-05-20T17:43:49,0.64,"Rain, Partially cloudy",Partly cloudy throughout the day with rain.,rain,"96741099999,WIII,96739099999,96749099999,96751099999,96745099999"
"-6.2155, 106.803",5/21/2022,31,25,27.4,39.1,25,30.5,24.7,85.9,0.643,100,8.33,rain,0,0,18.7,20.5,99.8,1009.4,60.3,6.2,115.3,10.1,4,30,2022-05-21T05:54:59,2022-05-21T17:43:47,0.68,"Rain, Partially cloudy",Partly cloudy throughout the day with rain.,rain,"96741099999,WIII,96739099999,96749099999,96751099999,96745099999"
"-6.2155, 106.803",5/22/2022,30,26,27.5,37.4,26,30.5,24.8,85.6,0,0,0,rain,0,0,24.5,22.3,105.4,1007.9,60.8,6.7,161.3,14,6,10,2022-05-22T05:55:09,2022-05-22T17:43:45,0.71,Partially cloudy,Partly cloudy throughout the day.,partly-cloudy-day,"96741099999,WIII,96739099999,96749099999,96751099999,96745099999"
"-6.2155, 106.803",5/23/2022,32.6,25,28.6,40.7,25,32.8,25,81.8,0,0,0,rain,0,0,28.4,27.7,86.3,1007.9,45.8,6.9,219.5,18.8,8,30,2022-05-23T05:55:19,2022-05-23T17:43:45,0.75,Partially cloudy,Partly cloudy throughout the day.,partly-cloudy-day,"96741099999,WIII,96739099999,96749099999,96751099999,96745099999"
"-6.2155, 106.803",5/24/2022,33,26,29.6,42.1,26,35.1,25.1,77.4,0,0,0,rain,0,0,32.4,27.7,87.8,1009.3,46.9,7.5,199.2,17.3,7,30,2022-05-24T05:55:30,2022-05-24T17:43:45,0.78,Partially cloudy,Partly cloudy throughout the day.,partly-cloudy-day,"96741099999,WIII,96739099999,96749099999,96751099999,96745099999"
"-6.2155, 106.803",5/25/2022,31.6,26,27.8,38.3,26,31.6,25.1,85.6,1.499,100,16.67,rain,0,0,29.9,24.1,66.1,1010.3,61.7,6.2,166.1,14.4,6,30,2022-05-25T05:55:41,2022-05-25T17:43:45,0.82,"Rain, Partially cloudy",Partly cloudy throughout the day with rain.,rain,"96737099999,96741099999,WIII,96739099999,96749099999,96751099999,96745099999"
"-6.2155, 106.803",5/26/2022,30,25,27.1,35.1,25,29.6,24.3,85.2,0.744,100,8.33,rain,0,0,22.7,14.8,95.7,1009.9,59.3,6.6,129.8,11.3,6,10,2022-05-26T05:55:52,2022-05-26T17:43:46,0.85,"Rain, Partially cloudy",Partly cloudy throughout the day with rain in the morning and afternoon.,rain,"96741099999,WIII,96739099999,96749099999,96751099999,96745099999"
"-6.2155, 106.803",5/27/2022,33,24,28.3,38.1,24,31.6,24,78.6,1.019,100,8.33,rain,0,0,17.6,21.1,307.6,1008.9,46,5.9,222.2,19.2,8,60,2022-05-27T05:56:04,2022-05-27T17:43:48,0.89,"Rain, Partially cloudy",Partly cloudy throughout the day with late afternoon rain.,rain,"96741099999,WIII,96739099999,96749099999,96751099999,96745099999"
"-6.2155, 106.803",5/28/2022,28.9,22,25.9,32.8,22,27.6,23.8,88.3,21.632,100,20.83,rain,0,0,64.8,22.3,307.8,1009.2,65.2,5.7,203.9,17.9,8,30,2022-05-28T05:56:16,2022-05-28T17:43:51,0.92,"Rain, Partially cloudy",Partly cloudy throughout the day with a chance of rain throughout the day.,rain,"96741099999,WIII,96739099999,96749099999,96751099999,96745099999"
"-6.2155, 106.803",5/29/2022,32,23,26.9,38.2,23,29.6,23.9,84.7,24.241,100,20.83,rain,0,0,27.4,16.6,257.1,1008.9,60.8,7.1,223.6,19.3,8,30,2022-05-29T05:56:28,2022-05-29T17:43:54,0.96,"Rain, Partially cloudy",Partly cloudy throughout the day with rain.,rain,"96737099999,96741099999,WIII,96739099999,96749099999,96751099999,96745099999"
"-6.2155, 106.803",5/30/2022,30,25,26.6,36.2,25,28.2,24.8,90.1,0.039,100,8.33,rain,0,0,22.3,33.5,270.9,1008.2,48.6,6.9,205.9,17.9,8,10,2022-05-30T05:56:40,2022-05-30T17:43:58,0,"Rain, Partially cloudy",Partly cloudy throughout the day with morning rain.,rain,"96741099999,WIII,96739099999,96749099999,96751099999,96745099999"
"-6.2155, 106.803",5/31/2022,32,24,27.1,39.2,24,29.4,24.4,86.2,1.377,100,8.33,rain,0,0,38.9,24.1,261.6,1008,43.7,6.7,180.1,15.6,6,30,2022-05-31T05:56:53,2022-05-31T17:44:02,0.02,"Rain, Partially cloudy",Partly cloudy throughout the day with rain.,rain,"96741099999,WIII,96739099999,96749099999,96751099999,96745099999"
"-6.2155, 106.803",6/1/2022,33.3,25,28.2,39.3,25,31.4,24.2,80.1,0.453,100,4.17,rain,0,0,24.8,24.1,259.8,1008.5,45.3,7.8,225.6,19.7,8,30,2022-06-01T05:57:06,2022-06-01T17:44:07,0.06,"Rain, Partially cloudy",Partly cloudy throughout the day with morning rain.,rain,"96741099999,WIII,96739099999,96749099999,96751099999,96745099999"
"-6.2155, 106.803",6/2/2022,33.5,25,27.7,40.6,25,30.3,24.7,85.2,29.239,100,16.67,rain,0,0,20.9,20.5,199.4,1009,58.1,6.8,203.1,17.6,8,30,2022-06-02T05:57:19,2022-06-02T17:44:13,0.09,"Rain, Partially cloudy",Partly cloudy throughout the day with rain.,rain,"96741099999,WIII,96739099999,96749099999,96751099999,96745099999"
"-6.2155, 106.803",6/3/2022,32.1,24,28,37.9,24,31.3,24.3,81.8,0.722,100,12.5,rain,0,0,17.6,23.9,296.3,1009.5,52.1,6.6,213.3,18.4,8,30,2022-06-03T05:57:33,2022-06-03T17:44:19,0.12,"Rain, Partially cloudy",Partly cloudy throughout the day with rain.,rain,"96741099999,WIII,96739099999,96749099999,96751099999,96745099999"
"-6.2155, 106.803",6/4/2022,33,25,28.6,40.6,25,32.3,24.5,79.6,0.059,100,8.33,rain,0,0,21.2,16.6,277.3,1009.7,46.9,7.2,215.5,18.5,8,30,2022-06-04T05:57:46,2022-06-04T17:44:25,0.16,"Rain, Partially cloudy",Partly cloudy throughout the day with late afternoon rain.,rain,"96737099999,96741099999,WIII,96739099999,96749099999,96751099999,96745099999"
"-6.2155, 106.803",6/5/2022,32,24,28.1,38.6,24,31.1,24,79.8,0.31,100,20.83,rain,0,0,22,19.9,347.1,1009.5,51.5,6.8,222,19.1,8,30,2022-06-05T05:58:00,2022-06-05T17:44:32,0.19,"Rain, Partially cloudy",Partly cloudy throughout the day with rain.,rain,"96741099999,WIII,96739099999,96749099999,96751099999,96745099999"
"-6.2155, 106.803",6/6/2022,30.8,24,27,36.2,24,29.2,24.1,84.6,1.459,100,12.5,rain,0,0,16.9,18.4,103.4,1009.2,66.2,6,109.6,9.6,5,10,2022-06-06T05:58:14,2022-06-06T17:44:40,0.22,"Rain, Partially cloudy",Partly cloudy throughout the day with rain.,rain,"96741099999,WIII,96739099999,96749099999,96751099999,96745099999"
"-6.2155, 106.803",6/7/2022,31.8,24,27.7,40.6,24,31.6,24.8,84.8,3.293,100,4.17,rain,0,0,25.6,29.5,91.5,1008.4,54.3,7,205.5,17.8,8,30,2022-06-07T05:58:28,2022-06-07T17:44:48,0.25,"Rain, Partially cloudy",Partly cloudy throughout the day with late afternoon rain.,rain,"96741099999,WIII,96739099999,96749099999,96751099999,96745099999"
"-6.2155, 106.803",6/8/2022,30,25,27.4,38.8,25,31,25,87.2,10.684,100,25,rain,0,0,26.6,16.6,84.7,1009,53.8,6.7,187.5,16.2,7,30,2022-06-08T05:58:42,2022-06-08T17:44:57,0.29,"Rain, Partially cloudy",Partly cloudy throughout the day with rain.,rain,"96741099999,WIII,96739099999,96749099999,96751099999,96745099999"
"-6.2155, 106.803",6/9/2022,30,25,26.4,37.4,25,27.9,24.6,90.1,6.28,100,16.67,rain,0,0,23.4,22.3,130.1,1009.6,55.2,5.3,131.6,11.3,6,30,2022-06-09T05:58:56,2022-06-09T17:45:06,0.32,"Rain, Partially cloudy",Partly cloudy throughout the day with rain.,rain,"96741099999,WIII,96739099999,96749099999,96751099999,96745099999"
"-6.2155, 106.803",6/10/2022,32.1,24,27.9,37.9,24,31,24.1,81.2,0.071,100,8.33,rain,0,0,18.7,18.4,15.7,1008.7,47.5,6.9,216.1,18.7,8,30,2022-06-10T05:59:11,2022-06-10T17:45:16,0.36,"Rain, Partially cloudy",Partly cloudy throughout the day with late afternoon rain.,rain,"96741099999,WIII,96739099999,96749099999,96751099999,96745099999"
"-6.2155, 106.803",6/11/2022,32,25,28.1,40.7,25,32.2,25.3,85.4,3.21,100,25,rain,0,0,24.5,25.9,90.4,1009.2,59.7,6.3,200.3,17.5,7,30,2022-06-11T05:59:25,2022-06-11T17:45:26,0.39,"Rain, Partially cloudy",Partly cloudy throughout the day with a chance of rain throughout the day.,rain,"96741099999,WIII,96739099999,96749099999,96751099999,96745099999"
"-6.2155, 106.803",6/12/2022,31.1,24,27.5,37.7,24,30.6,24.6,84.6,0.154,100,16.67,rain,0,0,23.8,16.6,255.4,1009.7,56,5.4,192.6,16.5,7,30,2022-06-12T05:59:39,2022-06-12T17:45:36,0.42,"Rain, Partially cloudy",Partly cloudy throughout the day with rain.,rain,"96741099999,WIII,96739099999,96749099999,96751099999,96745099999"
"-6.2155, 106.803",6/13/2022,31,24,27.5,39.1,24,29.8,24.1,83,0.059,100,8.33,rain,0,0,19.4,14.8,243.9,1010,51,6.2,188.2,16.2,6,30,2022-06-13T05:59:53,2022-06-13T17:45:47,0.46,"Rain, Partially cloudy",Partly cloudy throughout the day with rain.,rain,"96741099999,WIII,96739099999,96749099999,96751099999,96745099999"
"-6.2155, 106.803",6/14/2022,31.1,25,27.7,37.7,25,30.4,24.1,81.8,0.02,100,4.17,rain,0,0,21.6,25.9,110.5,1009.7,57,6,170.1,14.8,7,30,2022-06-14T06:00:07,2022-06-14T17:45:58,0.5,"Rain, Partially cloudy",Partly cloudy throughout the day with afternoon rain.,rain,"96741099999,WIII,96739099999,96749099999,96751099999,96745099999"
"-6.2155, 106.803",6/15/2022,30,24,26.7,37.4,24,28.7,24.6,88.8,4.734,100,12.5,rain,0,0,32.8,18.4,144.9,1009.9,55.4,4.7,169.6,14.6,7,30,2022-06-15T06:00:22,2022-06-15T17:46:09,0.52,"Rain, Partially cloudy",Partly cloudy throughout the day with rain.,rain,"96741099999,WIII,96739099999,96749099999,96751099999,96745099999"
"-6.2155, 106.803",6/16/2022,29,24,26.7,35.6,24,29.3,24.5,88.5,0,0,0,rain,0,0,24.1,20.5,54.1,1010.2,56.5,5.3,169,14.5,6,30,2022-06-16T06:00:36,2022-06-16T17:46:21,0.56,Partially cloudy,Partly cloudy throughout the day.,partly-cloudy-day,"96741099999,WIII,96739099999,96749099999,96751099999,96745099999"
"-6.2155, 106.803",6/17/2022,28.5,24,26.5,33.8,24,28.6,24.6,89.3,0.038,100,12.5,rain,0,0,15.8,20.5,122.4,1010.4,64.4,5.2,103.7,8.9,5,30,2022-06-17T06:00:50,2022-06-17T17:46:33,0.59,"Rain, Partially cloudy",Partly cloudy throughout the day with rain.,rain,"96741099999,WIII,96739099999,96749099999,96751099999,96745099999"
"-6.2155, 106.803",6/18/2022,31,24,26.7,36.5,24,28.7,23.8,84.9,0.006,100,4.17,rain,0,0,19.4,12.2,293.9,1010.5,42.9,5.5,209.9,17.9,7,30,2022-06-18T06:01:03,2022-06-18T17:46:45,0.63,"Rain, Partially cloudy",Partly cloudy throughout the day with late afternoon rain.,rain,"96741099999,WIII,96739099999,96749099999,96751099999,96745099999"
"-6.2155, 106.803",6/19/2022,32,24,28,37.9,24,31.4,24.3,81.5,0.003,100,4.17,rain,0,0,22,24.1,65.5,1009.4,42.8,6.1,223.9,19.3,8,30,2022-06-19T06:01:17,2022-06-19T17:46:58,0.66,"Rain, Partially cloudy",Partly cloudy throughout the day with late afternoon rain.,rain,"96741099999,WIII,96739099999,96749099999,96751099999,96745099999"
"-6.2155, 106.803",6/20/2022,32,24,28.1,38.2,24,31.3,24.3,81.1,1.236,100,12.5,rain,0,0,19.1,15.3,301.8,1008.4,52.3,4.8,194.1,16.8,7,30,2022-06-20T06:01:30,2022-06-20T17:47:11,0.7,"Rain, Partially cloudy",Partly cloudy throughout the day with rain.,rain,"96741099999,WIII,96739099999,96749099999,96751099999,96745099999"
"-6.2155, 106.803",6/21/2022,32.1,25,28.2,39.2,25,31.7,24.2,79.3,0,0,0,rain,0,0,24.1,25.9,90.4,1007.9,50.2,5.8,223.1,19.3,8,30,2022-06-21T06:01:44,2022-06-21T17:47:24,0.75,Partially cloudy,Partly cloudy throughout the day.,partly-cloudy-day,"96741099999,WIII,96739099999,96749099999,96751099999,96745099999"
"-6.2155, 106.803",6/22/2022,32,25,27.9,40.4,25,32.1,25.1,85.1,15.202,100,16.67,rain,0,0,44.6,24.1,92.6,1009.2,53.1,5.3,207.3,18,7,30,2022-06-22T06:01:57,2022-06-22T17:47:37,0.76,"Rain, Partially cloudy",Partly cloudy throughout the day with rain.,rain,"96741099999,WIII,96739099999,96749099999,96751099999,96745099999"
"-6.2155, 106.803",6/23/2022,33,25,28.4,37.3,25,31.3,23.9,78.1,0.004,100,4.17,rain,0,0,35.3,22.3,87.2,1010.1,44,6.5,227,19.7,8,30,2022-06-23T06:02:10,2022-06-23T17:47:50,0.8,"Rain, Partially cloudy",Partly cloudy throughout the day with late afternoon rain.,rain,"96741099999,WIII,96739099999,96749099999,96751099999,96745099999"
"-6.2155, 106.803",6/24/2022,30.1,25,27.6,36.2,25,30.6,24.4,83.2,0.02,100,8.33,rain,0,0,22.7,22.3,80.9,1009.4,53.3,4.9,189.9,16.6,8,30,2022-06-24T06:02:22,2022-06-24T17:48:04,0.83,"Rain, Partially cloudy",Partly cloudy throughout the day with rain.,rain,"96741099999,WIII,96739099999,96749099999,96751099999,96745099999"
"-6.2155, 106.803",6/25/2022,32,24,27.6,37.9,24,30,24.1,82.4,2.226,100,16.67,rain,0,0,20.2,18.4,0.8,1008.6,55.1,5.7,188.5,16.4,7,10,2022-06-25T06:02:34,2022-06-25T17:48:17,0.87,"Rain, Partially cloudy",Partly cloudy throughout the day with rain.,rain,"96741099999,WIII,96739099999,96749099999,96751099999,96745099999"
"-6.2155, 106.803",6/26/2022,30,24,27.3,37.4,24,30.2,24.5,85.3,0.254,100,4.17,rain,0,0,19.4,14.8,35.8,1009.7,56.1,6,141.7,12.2,6,10,2022-06-26T06:02:46,2022-06-26T17:48:31,0.9,"Rain, Partially cloudy",Partly cloudy throughout the day with afternoon rain.,rain,"96741099999,WIII,96739099999,96749099999,96751099999,96745099999"
"-6.2155, 106.803",6/27/2022,32.4,25,28.1,37.6,25,31.3,24.6,82.2,18.787,100,20.83,rain,0,0,19.8,14.8,9.3,1009.8,61.3,5.6,171.8,14.9,7,10,2022-06-27T06:02:58,2022-06-27T17:48:44,0.93,"Rain, Partially cloudy",Partly cloudy throughout the day with rain.,rain,"96741099999,WIII,96739099999,96749099999,96751099999,96745099999"
"-6.2155, 106.803",6/28/2022,32,25,28.1,37.9,25,31.2,24.5,81.8,0.471,100,8.33,rain,0,0,20.2,16.7,42.7,1008.4,54.4,6,207.4,17.9,7,10,2022-06-28T06:03:09,2022-06-28T17:48:58,0.97,"Rain, Partially cloudy",Partly cloudy throughout the day with early morning rain.,rain,"96741099999,WIII,96739099999,96749099999,96751099999,96745099999"
"-6.2155, 106.803",6/29/2022,31.9,25,28.1,36.5,25,31.2,23.8,78.7,0,0,0,rain,0,0,17.3,24.9,303.3,1007.8,47.5,7.2,229.6,20,8,10,2022-06-29T06:03:20,2022-06-29T17:49:12,0,Partially cloudy,Partly cloudy throughout the day.,partly-cloudy-day,"96741099999,WIII,96739099999,96749099999,96751099999,96745099999"
"-6.2155, 106.803",6/30/2022,31.1,24,27.9,36.5,24,30.4,22.4,72.8,0,0,0,rain,0,0,18,18.6,346.7,1008.3,43,7.3,230.2,19.9,8,10,2022-06-30T06:03:30,2022-06-30T17:49:25,0.04,Partially cloudy,Partly cloudy throughout the day.,partly-cloudy-day,"96741099999,WIII,96739099999,96749099999,96751099999,96745099999"
"-6.2155, 106.803",7/1/2022,32.7,25,28.5,36.6,25,31.2,23.1,73.9,0,0,0,rain,0,0,18.7,22.3,80.9,1008,45.9,7,246.4,21.3,8,10,2022-07-01T06:03:40,2022-07-01T17:49:39,0.07,Partially cloudy,Partly cloudy throughout the day.,partly-cloudy-day,"96741099999,WIII,96739099999,96749099999,96751099999,96745099999"
"-6.2155, 106.803",7/2/2022,32.1,26,28.8,37.9,26,32.8,24,76.3,0.073,100,4.17,rain,0,0,23,18.4,289,1007.6,54.9,5.2,204.9,17.6,7,10,2022-07-02T06:03:49,2022-07-02T17:49:53,0.11,"Rain, Partially cloudy",Partly cloudy throughout the day with late afternoon rain.,rain,"96741099999,WIII,96739099999,96749099999,96751099999,96745099999"
"-6.2155, 106.803",7/3/2022,32,26,28.6,40.7,26,33.7,25.6,84.5,17.91,100,12.5,rain,0,0,29.5,24.1,50.8,1007.5,57.7,6,212.6,18.4,8,30,2022-07-03T06:03:58,2022-07-03T17:50:06,0.14,"Rain, Partially cloudy",Partly cloudy throughout the day with rain clearing later.,rain,"96741099999,WIII,96739099999,96749099999,96751099999,96745099999"
"-6.2155, 106.803",7/4/2022,32.7,27,29.3,40.7,30.6,35.1,25.3,79.6,0.433,100,4.17,rain,0,0,33.8,33.5,82.3,1008,47.3,7.5,203.1,17.5,7,30,2022-07-04T06:04:07,2022-07-04T17:50:20,0.17,"Rain, Partially cloudy",Partly cloudy throughout the day with morning rain.,rain,"96741099999,WIII,96739099999,96749099999,96751099999,96745099999"
"-6.2155, 106.803",7/5/2022,33,26,29.5,40,26,35,25.3,79.6,0.045,100,12.5,rain,0,0,22.3,20.5,55.7,1008.5,43.9,7,207.8,17.9,8,30,2022-07-05T06:04:15,2022-07-05T17:50:33,0.21,"Rain, Partially cloudy",Partly cloudy throughout the day with rain.,rain,"96741099999,WIII,96739099999,96749099999,96751099999,96745099999"
"-6.2155, 106.803",7/6/2022,28.7,24,26.8,34.5,24,29.4,24.9,89.8,28.455,100,20.83,rain,0,0,20.2,13,38.8,1010.3,58,5.7,192.9,16.7,8,30,2022-07-06T06:04:22,2022-07-06T17:50:46,0.24,"Rain, Partially cloudy",Partly cloudy throughout the day with a chance of rain throughout the day.,rain,"96741099999,WIII,96739099999,96749099999,96751099999,96745099999"
"-6.2155, 106.803",7/7/2022,32,25,28.4,39.2,25,32.4,25.2,83.8,0.044,100,4.17,rain,0,0,15.5,13,15.5,1009.8,43.7,5.7,207.5,18,7,30,2022-07-07T06:04:29,2022-07-07T17:50:59,0.25,"Rain, Partially cloudy",Partly cloudy throughout the day with afternoon rain.,rain,"96741099999,WIII,96739099999,96749099999,96751099999,96745099999"
"-6.2155, 106.803",7/8/2022,33,25,28.9,39.3,25,33,24.2,76.9,0,0,0,rain,0,0,16.2,18.4,311,1008.9,44.7,6.1,231.4,20,8,30,2022-07-08T06:04:36,2022-07-08T17:51:12,0.31,Partially cloudy,Partly cloudy throughout the day.,partly-cloudy-day,"96737099999,96741099999,WIII,96739099999,96749099999,96751099999,96745099999"
"-6.2155, 106.803",7/9/2022,32,24,28.2,35.8,24,30.7,22.5,72.2,0,0,0,rain,0,0,18.4,21.5,2.7,1008.4,48.6,7.9,216.4,18.7,8,10,2022-07-09T06:04:41,2022-07-09T17:51:24,0.34,Partially cloudy,Partly cloudy throughout the day.,partly-cloudy-day,"96741099999,WIII,96739099999,96749099999,96751099999,96745099999"
"-6.2155, 106.803",7/10/2022,32.3,24,28.2,36.2,24,30.6,22.2,70.6,0,0,0,rain,0,0,35.3,25.9,85,1008.7,39.6,7.4,226.8,19.6,8,10,2022-07-10T06:04:47,2022-07-10T17:51:37,0.38,Partially cloudy,Partly cloudy throughout the day.,partly-cloudy-day,"96741099999,WIII,96739099999,96749099999,96751099999,96745099999"
"-6.2155, 106.803",7/11/2022,32,25,28.4,35.8,25,31.1,23.2,74.6,0,0,0,rain,0,0,16.2,18.4,94.8,1009.4,41.3,6.8,197.9,17,8,10,2022-07-11T06:04:51,2022-07-11T17:51:49,0.41,Partially cloudy,Partly cloudy throughout the day.,partly-cloudy-day,"96741099999,WIII,96739099999,96749099999,96751099999,96745099999"
"-6.2155, 106.803",7/12/2022,32.5,26,28.9,38.4,26,33.6,24.9,79.7,0.171,100,12.5,rain,0,0,24.5,27.7,85.9,1008.7,44.2,6.4,201.8,17.4,7,30,2022-07-12T06:04:55,2022-07-12T17:52:01,0.45,"Rain, Partially cloudy",Partly cloudy throughout the day with rain.,rain,"96741099999,WIII,96739099999,96749099999,96751099999,96745099999"
"-6.2155, 106.803",7/13/2022,31.6,24,27,37.6,24,29.8,24.6,87.4,2.379,100,16.67,rain,0,0,24.8,20.5,134.4,1008.4,65.3,5.3,131.6,11.3,5,30,2022-07-13T06:04:58,2022-07-13T17:52:12,0.48,"Rain, Partially cloudy",Partly cloudy throughout the day with rain.,rain,"96741099999,WIII,96739099999,96749099999,96751099999,96745099999"
"-6.2155, 106.803",7/14/2022,32.5,25,28.1,38.7,25,31.9,24.6,82,0.01,100,12.5,rain,0,0,30.6,25.9,76.1,1008.3,47.1,6.6,163.3,14.1,7,30,2022-07-14T06:05:01,2022-07-14T17:52:23,0.5,"Rain, Partially cloudy",Partly cloudy throughout the day with rain.,rain,"96741099999,WIII,96739099999,96749099999,96751099999,96745099999"
"-6.2155, 106.803",7/15/2022,32.6,24,28.1,40.7,24,31.9,24.6,82.2,9.726,100,16.67,rain,0,0,23.8,25.9,69.1,1009,53.2,6.7,166.7,14.4,6,60,2022-07-15T06:05:03,2022-07-15T17:52:34,0.55,"Rain, Partially cloudy",Partly cloudy throughout the day with rain.,rain,"96741099999,WIII,96739099999,96749099999,96751099999,96745099999"
"-6.2155, 106.803",7/16/2022,29.6,23,25.6,33,23,26.7,23,86.5,39.847,100,16.67,rain,0,0,25.9,22.3,224.3,1010.5,69.8,6.8,77.2,6.7,4,10,2022-07-16T06:05:04,2022-07-16T17:52:45,0.58,"Rain, Partially cloudy",Partly cloudy throughout the day with a chance of rain throughout the day.,rain,"96741099999,WIII,96739099999,96749099999,96751099999,96745099999"
"-6.2155, 106.803",7/17/2022,32,25,27.4,39.2,25,30.1,24.5,84.8,0,0,0,rain,0,0,30.6,22.3,95.4,1009.9,61.2,6.7,146.7,12.7,6,30,2022-07-17T06:05:05,2022-07-17T17:52:55,0.61,Partially cloudy,Partly cloudy throughout the day.,partly-cloudy-day,"96741099999,WIII,96739099999,96749099999,96751099999,96745099999"
"-6.2155, 106.803",7/18/2022,32,25,28.1,39.2,25,31.9,24.7,82.3,0.005,100,4.17,rain,0,0,17.6,14.8,5.5,1008.9,50.6,5.6,224.9,19.3,8,30,2022-07-18T06:05:05,2022-07-18T17:53:05,0.65,"Rain, Partially cloudy",Partly cloudy throughout the day with afternoon rain.,rain,"96741099999,WIII,96739099999,96749099999,96751099999,96745099999"
"-6.2155, 106.803",7/19/2022,32,26,28.8,39.2,26,33.4,25,80.8,0,0,0,rain,0,0,17.6,25.9,63.5,1008.4,42.1,6.3,232.7,20.1,8,30,2022-07-19T06:05:04,2022-07-19T17:53:14,0.68,Partially cloudy,Partly cloudy throughout the day.,partly-cloudy-day,"96741099999,WIII,96739099999,96749099999,96751099999,96745099999"
"-6.2155, 106.803",7/20/2022,32.7,26,29,39.7,26,34.1,25.1,80.5,0,0,0,rain,0,0,22,20.5,64,1009,46.7,5.9,216.4,18.9,8,30,2022-07-20T06:05:03,2022-07-20T17:53:23,0.75,Partially cloudy,Partly cloudy throughout the day.,partly-cloudy-day,"96741099999,WIII,96739099999,96749099999,96751099999,96745099999"
"-6.2155, 106.803",7/21/2022,32,25,28.5,37.9,25,31.9,24.2,78.8,0,0,0,,0,0,20.5,20.1,340.4,1009.3,38.3,6,239.8,20.6,8,10,2022-07-21T06:05:01,2022-07-21T17:53:32,0.75,Partially cloudy,Partly cloudy throughout the day.,partly-cloudy-day,"96741099999,WIII,96739099999,96749099999,96751099999,96745099999"
"-6.2155, 106.803",7/22/2022,32,26,28.4,37.9,26,32.4,24.6,80.6,0.074,100,8.33,rain,0,0,31.7,29.5,73.2,1010.2,50.1,5.3,201,17.4,7,30,2022-07-22T06:04:58,2022-07-22T17:53:40,0.78,"Rain, Partially cloudy",Partly cloudy throughout the day with rain.,rain,"96741099999,WIII,96739099999,96749099999,96751099999,96745099999"
"-6.2155, 106.803",7/23/2022,32.4,25,28.6,39.2,25,32.4,24.5,79.5,0.035,100,8.33,rain,0,0,23,18.4,68.1,1009.5,42.3,7.1,219.7,19,7,30,2022-07-23T06:04:54,2022-07-23T17:53:48,0.82,"Rain, Partially cloudy",Partly cloudy throughout the day with late afternoon rain.,rain,"96741099999,WIII,96739099999,96749099999,96751099999,96745099999"
"-6.2155, 106.803",7/24/2022,33.4,25,28.6,39,25,32.1,24.1,77.8,0.216,100,20.83,rain,0,0,21.2,19.2,347,1008.1,42.8,7.3,204.5,17.6,7,10,2022-07-24T06:04:50,2022-07-24T17:53:55,0.85,"Rain, Partially cloudy",Partly cloudy throughout the day with rain.,rain,"96741099999,WIII,96739099999,96749099999,96751099999,96745099999"
"-6.2155, 106.803",7/25/2022,31.4,25,28.2,36.5,25,31.5,24.1,79.3,0.909,100,12.5,rain,0,0,20.5,18.4,30.6,1008.3,66.1,6.2,205.1,17.6,7,10,2022-07-25T06:04:45,2022-07-25T17:54:02,0.88,"Rain, Partially cloudy",Partly cloudy throughout the day with rain clearing later.,rain,"96741099999,WIII,96739099999,96749099999,96751099999,96745099999"
"-6.2155, 106.803",7/26/2022,32,25,28.4,36.8,25,31.4,23.1,74.2,0,0,0,,0,0,23.4,24.1,71.5,1009,48.5,7,223.2,19.4,7,10,2022-07-26T06:04:39,2022-07-26T17:54:09,0.92,Partially cloudy,Partly cloudy throughout the day.,partly-cloudy-day,"96741099999,WIII,96739099999,96749099999,96751099999,96745099999"
"-6.2155, 106.803",7/27/2022,32.7,25,28.5,36.8,25,31.1,23,73.1,0,0,0,,0,0,23,16.6,77.2,1008.8,43.7,6.2,240.3,20.7,8,10,2022-07-27T06:04:33,2022-07-27T17:54:15,0.95,Partially cloudy,Partly cloudy throughout the day.,partly-cloudy-day,"96741099999,WIII,96739099999,96749099999,96751099999,96745099999"
"-6.2155, 106.803",7/28/2022,33,26,29,39.3,26,32.9,24,75.2,0,0,0,,0,0,30.6,27.7,78.7,1008.4,42.5,7.4,228.6,19.7,8,10,2022-07-28T06:04:25,2022-07-28T17:54:20,0.98,Partially cloudy,Partly cloudy throughout the day.,partly-cloudy-day,"96741099999,WIII,96739099999,96749099999,96751099999,96745099999"
"-6.2155, 106.803",7/29/2022,33,26,29.2,40.6,26,34,24.6,77.1,0.632,100,8.33,rain,0,0,24.1,27.7,81.3,1008.6,44.7,8.1,238.2,20.7,8,30,2022-07-29T06:04:17,2022-07-29T17:54:25,0,"Rain, Partially cloudy",Partly cloudy throughout the day with rain.,rain,"96737099999,96741099999,WIII,96739099999,96749099999,96751099999,96745099999"
"-6.2155, 106.803",7/30/2022,32,25,28.5,38.2,25,32.4,24.7,80.6,0,0,0,rain,0,0,18.7,22.3,33.6,1009.2,46.5,6.6,229.2,19.8,8,10,2022-07-30T06:04:09,2022-07-30T17:54:30,0.05,Partially cloudy,Partly cloudy throughout the day.,partly-cloudy-day,"96741099999,WIII,96739099999,96749099999,96751099999,96745099999"
"-6.2155, 106.803",7/31/2022,32,26,28.8,39.2,26,33,24.5,79,0,0,0,rain,0,0,26.6,27.7,72.4,1008,46.5,6.7,232.1,19.9,8,30,2022-07-31T06:03:59,2022-07-31T17:54:34,0.09,Partially cloudy,Partly cloudy throughout the day.,partly-cloudy-day,"96741099999,WIII,96739099999,96749099999,96751099999,96745099999"
"-6.2155, 106.803",8/1/2022,33,25,28.9,40.6,25,32.9,24.4,77.9,0,0,0,,0,0,27,25.9,73.1,1008.1,43.9,7.4,245.2,21.1,8,10,2022-08-01T06:03:49,2022-08-01T17:54:38,0.12,Partially cloudy,Partly cloudy throughout the day.,partly-cloudy-day,"96741099999,WIII,96739099999,96749099999,96751099999,96745099999"
"-6.2155, 106.803",8/2/2022,32,26,29,37.9,26,33.3,24.4,77,0,0,0,,0,0,19.4,20.2,31.1,1008.6,43.6,6,238,20.5,8,10,2022-08-02T06:03:38,2022-08-02T17:54:41,0.16,Partially cloudy,Partly cloudy throughout the day.,partly-cloudy-day,"96741099999,WIII,96739099999,96749099999,96751099999,96745099999"
"-6.2155, 106.803",8/3/2022,32.6,26,28.9,40.7,26,33.6,24.8,79.6,1.586,100,16.67,rain,0,0,25.2,20.5,78.2,1009.2,61.1,5.4,196.2,17,7,10,2022-08-03T06:03:26,2022-08-03T17:54:43,0.19,"Rain, Partially cloudy",Partly cloudy throughout the day with rain.,rain,"96741099999,WIII,96739099999,96749099999,96751099999,96745099999"
"-6.2155, 106.803",8/4/2022,31,24,27.6,37.7,24,30.7,24.8,85.6,11.506,100,25,rain,0,0,31.7,24.6,1.3,1009.9,63.7,5.9,177,15.4,6,30,2022-08-04T06:03:14,2022-08-04T17:54:46,0.23,"Rain, Partially cloudy",Partly cloudy throughout the day with a chance of rain throughout the day.,rain,"96741099999,WIII,96739099999,96749099999,96751099999,96745099999"
"-6.2155, 106.803",8/5/2022,30.3,25,27.5,36.2,25,30.3,24.8,86,13.624,100,12.5,rain,0,0,22.3,24.1,329.9,1010.2,58.5,6.3,204.6,17.7,7,10,2022-08-05T06:03:01,2022-08-05T17:54:47,0.25,"Rain, Partially cloudy",Partly cloudy throughout the day with rain clearing later.,rain,"96741099999,WIII,96739099999,96749099999,96751099999,96745099999"
"-6.2155, 106.803",8/6/2022,32,24,27.9,36.8,24,30.4,23.7,79.3,3.475,100,8.33,rain,0,0,15.5,24.1,345.2,1010,50.2,6.3,238.7,20.6,8,30,2022-08-06T06:02:47,2022-08-06T17:54:48,0.3,"Rain, Partially cloudy",Partly cloudy throughout the day with late afternoon rain.,rain,"96737099999,96741099999,WIII,96739099999,96749099999,96751099999,96745099999"
"-6.2155, 106.803",8/7/2022,32,24,27.8,37.7,24,30.5,23.9,80.2,0.982,100,12.5,rain,0,0,38.9,16.6,17.7,1009.6,52.1,6.4,241,20.9,8,30,2022-08-07T06:02:33,2022-08-07T17:54:49,0.33,"Rain, Partially cloudy",Partly cloudy throughout the day with rain.,rain,"96737099999,96741099999,WIII,96739099999,96749099999,96751099999,96745099999"
"-6.2155, 106.803",8/8/2022,32.1,24,28.3,36.9,24,31.3,23.5,76.3,0,0,0,rain,0,0,18,18.4,319.3,1008.9,45.3,6.8,254.6,22.1,9,10,2022-08-08T06:02:17,2022-08-08T17:54:49,0.37,Partially cloudy,Partly cloudy throughout the day.,partly-cloudy-day,"96741099999,WIII,96739099999,96749099999,96751099999,96745099999"
"-6.2155, 106.803",8/9/2022,32,25,28.7,37.9,25,31.9,23.5,74.5,1.019,100,8.33,rain,0,0,17.3,17.9,354.6,1008.8,50.6,6.8,239,20.6,8,10,2022-08-09T06:02:01,2022-08-09T17:54:49,0.4,"Rain, Partially cloudy",Partly cloudy throughout the day with rain clearing later.,rain,"96741099999,WIII,96739099999,WIHH,96749099999,96751099999,96745099999,96749599999"
"-6.2155, 106.803",8/10/2022,33.7,24,28.8,38.8,24,31.7,23.4,74.4,0.004,100,4.17,rain,0,0,21.2,21.3,92.2,1009.2,44.8,6.2,243.6,21.2,9,30,2022-08-10T06:01:45,2022-08-10T17:54:48,0.44,"Rain, Partially cloudy",Partly cloudy throughout the day with late afternoon rain.,rain,"96741099999,WIII,96739099999,WIHH,96749099999,96751099999,96745099999,96749599999"
"-6.2155, 106.803",8/11/2022,33.9,25,29.2,39.6,25,32.9,23.9,74.5,0.035,100,8.33,rain,0,0,21.2,23.4,82.2,1009,45.9,6.6,248.9,21.4,8,30,2022-08-11T06:01:28,2022-08-11T17:54:47,0.47,"Rain, Partially cloudy",Partly cloudy throughout the day with late afternoon rain.,rain,"96741099999,WIII,96739099999,WIHH,96749099999,96751099999,96745099999,96749599999"
"-6.2155, 106.803",8/12/2022,33,26,28.9,39.3,26,32.5,23.7,74.2,0.345,100,12.5,rain,0,0,21.2,21.4,105.8,1009.2,51.6,6.6,233,20.3,9,30,2022-08-12T06:01:10,2022-08-12T17:54:45,0.5,"Rain, Partially cloudy",Partly cloudy throughout the day with rain.,rain,"96741099999,WIII,96739099999,WIHH,96749099999,96751099999,96745099999,96749599999"
"-6.2155, 106.803",8/13/2022,33,24,28.4,38.1,24,31.8,23.5,75.9,0.038,100,8.33,rain,0,0,22,25.9,54.6,1009.4,41.6,7,236.9,20.4,8,30,2022-08-13T06:00:51,2022-08-13T17:54:43,0.54,"Rain, Partially cloudy",Partly cloudy throughout the day with rain.,rain,"96741099999,WIII,96739099999,96749099999,96751099999,96745099999"
"-6.2155, 106.803",8/14/2022,33,24,28.6,39.4,24,32.2,23.4,74.4,0.334,100,12.5,rain,0,0,40.7,27.7,95,1009.3,41.7,7,234.9,20.2,9,30,2022-08-14T06:00:32,2022-08-14T17:54:40,0.57,"Rain, Partially cloudy",Partly cloudy throughout the day with rain.,rain,"96741099999,WIII,96739099999,96749099999,96751099999,96745099999"
"-6.2155, 106.803",8/15/2022,32.5,24,28.5,38.4,24,31.7,23.3,74,0.419,100,4.17,rain,0,0,19.1,18.4,83.8,1010.1,54.7,6.3,195.7,16.9,7,30,2022-08-15T06:00:12,2022-08-15T17:54:37,0.6,"Rain, Partially cloudy",Partly cloudy throughout the day with late afternoon rain.,rain,"96737099999,96741099999,WIII,96739099999,WIHH,96749099999,96751099999,96745099999,96749599999"
"-6.2155, 106.803",8/16/2022,32,25,28.1,38.5,25,31.1,23.6,77.4,0.323,100,4.17,rain,0,0,22.3,16.9,278.5,1010.3,64.1,5.7,224.7,19.3,8,30,2022-08-16T05:59:52,2022-08-16T17:54:34,0.64,"Rain, Partially cloudy",Partly cloudy throughout the day with early morning rain.,rain,"96741099999,WIII,96739099999,WIHH,96749099999,96751099999,96745099999,96749599999"
"-6.2155, 106.803",8/17/2022,32,25,28.3,39.4,25,31.5,23.8,77,5.182,100,12.5,rain,0,0,26.6,27.7,97.4,1010.1,51,6.7,213.6,18.4,8,30,2022-08-17T05:59:31,2022-08-17T17:54:30,0.67,"Rain, Partially cloudy",Partly cloudy throughout the day with rain.,rain,"96741099999,WIII,96739099999,96749099999,96751099999,96745099999"
"-6.2155, 106.803",8/18/2022,33.2,26,29,37.2,26,31.9,22.3,68.3,0,0,0,,0,0,24.5,33.5,97.2,1009.2,49.3,7.4,250.6,21.7,9,30,2022-08-18T05:59:09,2022-08-18T17:54:25,0.7,Partially cloudy,Partly cloudy throughout the day.,partly-cloudy-day,"96741099999,WIII,96739099999,WIHH,96749099999,96751099999,96745099999,96749599999"
"-6.2155, 106.803",8/19/2022,34.4,25,29.4,37.5,25,32.1,22,66,0,0,0,,0,0,26.6,29.5,94.6,1009,42.4,7.5,271.1,23.4,9,10,2022-08-19T05:58:47,2022-08-19T17:54:20,0.75,Partially cloudy,Partly cloudy throughout the day.,partly-cloudy-day,"96741099999,WIII,96739099999,WIHH,96749099999,96751099999,96745099999,96749599999"
"-6.2155, 106.803",8/20/2022,33.3,26,29.2,38.2,26,32.6,23.1,70.6,0.005,100,8.33,rain,0,0,27.7,31.7,97.4,1008.8,42.9,7.2,248.7,21.5,8,10,2022-08-20T05:58:24,2022-08-20T17:54:15,0.77,"Rain, Partially cloudy",Partly cloudy throughout the day with late afternoon rain.,rain,"96741099999,WIII,96739099999,96749099999,96751099999,96745099999"
"-6.2155, 106.803",8/21/2022,32.2,24,28.6,37.9,24,31.7,23,72.4,2.036,100,8.33,rain,0,0,22.7,20.5,17.8,1009.3,52.7,7.3,213,18.5,8,10,2022-08-21T05:58:01,2022-08-21T17:54:09,0.8,"Rain, Partially cloudy",Partly cloudy throughout the day with late afternoon rain.,rain,"96741099999,WIII,96739099999,96749099999,96751099999,96745099999"
"-6.2155, 106.803",8/22/2022,31.2,24,27.3,35.8,24,29.6,23.5,80.7,0,0,0,rain,0,0,23.4,17,316.9,1009.7,55.5,5.6,209.3,18.1,8,30,2022-08-22T05:57:37,2022-08-22T17:54:03,0.83,Partially cloudy,Partly cloudy throughout the day.,partly-cloudy-day,"96741099999,WIII,96739099999,WIHH,96749099999,96751099999,96745099999,96749599999"
"-6.2155, 106.803",8/23/2022,33.9,25,29.1,38,25,32.1,23.2,72.2,0,0,0,rain,0,0,21.2,20.8,66.9,1009.3,49.8,5.1,258.8,22.3,9,30,2022-08-23T05:57:13,2022-08-23T17:53:57,0.86,Partially cloudy,Partly cloudy throughout the day.,partly-cloudy-day,"96741099999,WIII,96739099999,WIHH,96749099999,96751099999,96745099999,96749599999"
"-6.2155, 106.803",8/24/2022,33,26,29,37,26,32.5,23.3,72.3,0.153,100,4.17,rain,0,0,19.1,22.3,54.2,1009.5,51.6,6.6,260.2,22.6,9,10,2022-08-24T05:56:48,2022-08-24T17:53:50,0.9,"Rain, Partially cloudy",Partly cloudy throughout the day with late afternoon rain.,rain,"96741099999,WIII,96739099999,WIHH,96749099999,96751099999,96745099999,96749599999"
"-6.2155, 106.803",8/25/2022,33,26,29.1,36,26,31.6,22,66.6,0.018,100,4.17,rain,0,0,26.3,25.9,85.6,1009.2,50.1,7.1,261.1,22.5,9,10,2022-08-25T05:56:23,2022-08-25T17:53:43,0.93,"Rain, Partially cloudy",Partly cloudy throughout the day with early morning rain.,rain,"96741099999,WIII,96739099999,WIHH,96749099999,96751099999,96745099999,96749599999"
"-6.2155, 106.803",8/26/2022,31.8,25,28.7,36.5,25,31.2,22.2,68.5,0.003,100,4.17,rain,0,0,24.5,13.6,324.1,1008.8,47.1,5.6,239.3,20.7,9,10,2022-08-26T05:55:57,2022-08-26T17:53:35,0.96,"Rain, Partially cloudy",Partly cloudy throughout the day with late afternoon rain.,rain,"96737099999,96741099999,WIII,96739099999,WIHH,96749099999,96751099999,96745099999,96749599999"
"-6.2155, 106.803",8/27/2022,31,25,28,36.5,25,31.4,23.6,77.4,0.501,100,12.5,rain,0,0,24.1,18.4,312.2,1008.5,63.1,5.6,214.8,18.5,8,10,2022-08-27T05:55:31,2022-08-27T17:53:28,0,"Rain, Partially cloudy",Partly cloudy throughout the day with rain.,rain,"96741099999,WIII,96739099999,96749099999,96751099999,96745099999"
"-6.2155, 106.803",8/28/2022,30,25,27.4,36.1,25,30.2,23.9,81.8,0.615,100,8.33,rain,0,0,27.4,20.5,316.6,1008.7,59.3,5.5,213.3,18.5,8,10,2022-08-28T05:55:04,2022-08-28T17:53:19,0.03,"Rain, Partially cloudy",Partly cloudy throughout the day with rain.,rain,"96741099999,WIII,96739099999,96749099999,96751099999,96745099999"
"-6.2155, 106.803",8/29/2022,31.9,25,28,37.6,25,30.9,23.8,79,0.146,100,12.5,rain,0,0,18,20.5,327.7,1009,64.9,6.1,241.9,21,8,10,2022-08-29T05:54:37,2022-08-29T17:53:11,0.07,"Rain, Partially cloudy",Partly cloudy throughout the day with rain.,rain,"96741099999,WIII,96739099999,WIHH,96749099999,96751099999,96745099999,96749599999"
"-6.2155, 106.803",8/30/2022,32.7,25,28.7,38,25,31.7,23.2,73.1,0,0,0,rain,0,0,21.2,17.2,328.2,1008.8,51.2,6.2,241.3,20.8,8,10,2022-08-30T05:54:10,2022-08-30T17:53:02,0.1,Partially cloudy,Partly cloudy throughout the day.,partly-cloudy-day,"96741099999,WIII,96739099999,WIHH,96749099999,96751099999,96745099999,96749599999"
"-6.2155, 106.803",8/31/2022,32.5,25,28.8,36.3,25,31.7,23.1,72.8,0.108,100,4.17,rain,0,0,27.7,17.1,85.1,1008.4,49.5,5.9,227.8,19.8,8,10,2022-08-31T05:53:42,2022-08-31T17:52:53,0.14,"Rain, Partially cloudy",Partly cloudy throughout the day with morning rain.,rain,"96741099999,WIII,96739099999,WIHH,96749099999,96751099999,96745099999,96749599999"
"-6.2155, 106.803",9/1/2022,32.7,26,28.8,37.9,26,32.7,23.8,75.1,1.105,100,8.33,rain,0,0,32.8,33.5,97.2,1008.9,49.7,6.2,218.7,18.9,8,30,2022-09-01T05:53:13,2022-09-01T17:52:44,0.17,"Rain, Partially cloudy",Partly cloudy throughout the day with rain.,rain,"96741099999,WIII,96739099999,WIHH,96749099999,96751099999,96745099999,96749599999"
"-6.2155, 106.803",9/2/2022,33.5,24,28.3,38.9,24,31.6,23.9,78.1,0.783,100,12.5,rain,0,0,29.5,20.3,93.4,1010,52.7,6.3,251.9,21.8,9,30,2022-09-02T05:52:45,2022-09-02T17:52:34,0.21,"Rain, Partially cloudy",Partly cloudy throughout the day with rain.,rain,"96741099999,WIII,96739099999,WIHH,96749099999,96751099999,96745099999,96749599999"
"-6.2155, 106.803",9/3/2022,33,24,27.8,39.3,24,30.3,23.1,76.4,0.05,100,8.33,rain,0,0,48.2,29.5,243.6,1010.3,49.1,7.3,266.9,23.1,9,30,2022-09-03T05:52:16,2022-09-03T17:52:24,0.24,"Rain, Partially cloudy",Partly cloudy throughout the day with rain.,rain,"96741099999,WIII,96739099999,96749099999,96751099999,96745099999"
"-6.2155, 106.803",9/4/2022,33,25,28.2,38.1,25,30.9,23,74.5,0.258,100,8.33,rain,0,0,26.3,29.5,234,1009.8,62.5,7.6,269.8,23.3,10,30,2022-09-04T05:51:47,2022-09-04T17:52:14,0.25,"Rain, Partially cloudy",Partly cloudy throughout the day with rain.,rain,"96741099999,WIII,96739099999,96749099999,96751099999,96745099999"
"-6.2155, 106.803",9/5/2022,33,25,29.1,38.3,25,32.8,23.8,74.4,0.057,100,4.17,rain,0,0,25.6,22.3,41.8,1010.1,57.2,6.2,242.6,21,9,30,2022-09-05T05:51:17,2022-09-05T17:52:04,0.31,"Rain, Partially cloudy",Partly cloudy throughout the day with late afternoon rain.,rain,"96741099999,WIII,96739099999,WIHH,96749099999,96751099999,96745099999,96749599999"
"-6.2155, 106.803",9/6/2022,33.5,26,29,39.2,26,33,24.1,76,2.576,100,20.83,rain,0,0,24.8,27.7,65,1009.6,57,6.9,221.7,19.2,8,30,2022-09-06T05:50:48,2022-09-06T17:51:54,0.35,"Rain, Partially cloudy",Partly cloudy throughout the day with a chance of rain throughout the day.,rain,"96741099999,WIII,96739099999,WIHH,96749099999,96751099999,96745099999,96749599999"
"-6.2155, 106.803",9/7/2022,31.7,24,27.3,37.3,24,30,24.4,85.1,8.391,100,25,rain,0,0,24.1,24.1,247.8,1010.7,61.1,5.5,238.4,20.4,8,30,2022-09-07T05:50:17,2022-09-07T17:51:43,0.39,"Rain, Partially cloudy",Partly cloudy throughout the day with rain.,rain,"96741099999,WIII,96739099999,WIHH,96749099999,96751099999,96745099999,96749599999"
"-6.2155, 106.803",9/8/2022,28.1,25,26,32,25,26.7,24.1,89.6,3.865,100,20.83,rain,0,0,24.5,13,233.9,1012.2,63.6,4.8,127.8,11.1,6,10,2022-09-08T05:49:47,2022-09-08T17:51:33,0.42,"Rain, Partially cloudy",Partly cloudy throughout the day with a chance of rain throughout the day.,rain,"96737099999,96741099999,WIII,96739099999,WIHH,96749099999,96751099999,96745099999,96749599999"
"-6.2155, 106.803",9/9/2022,30.7,24,26.4,35.2,24,28,23.6,85.6,50.514,100,16.67,rain,0,0,25.6,18.4,228.6,1012.2,60.7,4.7,195.8,16.9,7,10,2022-09-09T05:49:17,2022-09-09T17:51:22,0.46,"Rain, Partially cloudy",Partly cloudy throughout the day with rain.,rain,"96741099999,WIII,96739099999,WIHH,96749099999,96751099999,96745099999,96749599999"
"-6.2155, 106.803",9/10/2022,30,24,26.1,36.2,24,27.7,23.8,87.7,2.994,100,25,rain,0,0,38.9,24.1,245.4,1011.6,63.6,5.6,148.1,12.9,8,30,2022-09-10T05:48:46,2022-09-10T17:51:11,0.5,"Rain, Partially cloudy",Partly cloudy throughout the day with rain.,rain,"96741099999,WIII,96739099999,96749099999,96751099999,96745099999"
"-6.2155, 106.803",9/11/2022,32,24,27.6,37.9,24,30.3,23.8,81.2,19.135,100,12.5,rain,0,0,20.9,20.5,17.3,1010.1,53.9,6.8,244.5,21.2,9,30,2022-09-11T05:48:15,2022-09-11T17:51:00,0.53,"Rain, Partially cloudy",Partly cloudy throughout the day with rain.,rain,"96741099999,WIII,96739099999,96749099999,96751099999,96745099999"
"-6.2155, 106.803",9/12/2022,31.5,24,27.5,37.2,24,30.4,23.6,79.9,0.275,100,12.5,rain,0,0,27,15.5,285.6,1010,56.5,6.1,245.5,21.1,9,30,2022-09-12T05:47:44,2022-09-12T17:50:48,0.56,"Rain, Partially cloudy",Partly cloudy throughout the day with rain.,rain,"96741099999,WIII,96739099999,WIHH,96749099999,96751099999,96745099999,96749599999"
"-6.2155, 106.803",9/13/2022,31.7,24,28,38.5,24,30.9,23.6,77.3,0.032,100,12.5,rain,0,0,19.8,17.9,255,1011.9,51.9,6.3,258.8,22.2,9,30,2022-09-13T05:47:13,2022-09-13T17:50:37,0.59,"Rain, Partially cloudy",Partly cloudy throughout the day with rain.,rain,"96741099999,WIII,96739099999,WIHH,96749099999,96751099999,96745099999,96749599999"
"-6.2155, 106.803",9/14/2022,32.2,24,28.2,37.4,24,30.6,22.5,72.2,0.001,100,4.17,rain,0,0,22,17.9,45.1,1012.7,42.8,6,235.7,20.2,8,30,2022-09-14T05:46:42,2022-09-14T17:50:26,0.62,"Rain, Partially cloudy",Partly cloudy throughout the day with early morning rain.,rain,"96741099999,WIII,96739099999,WIHH,96749099999,96751099999,96745099999,96749599999"
"-6.2155, 106.803",9/15/2022,32.7,25,28.7,37,25,31.5,22.8,71.6,0,0,0,rain,0,0,18,16,308,1011.1,47.8,6.2,240.6,20.7,8,30,2022-09-15T05:46:11,2022-09-15T17:50:14,0.65,Partially cloudy,Partly cloudy throughout the day.,partly-cloudy-day,"96741099999,WIII,96739099999,WIHH,96749099999,96751099999,96745099999,96749599999"
"-6.2155, 106.803",9/16/2022,32.9,25,28.3,37,25,31.1,23.1,74.5,0.463,100,8.33,rain,0,0,20.5,16.7,210.9,1010.2,51,5.8,248.3,21.4,8,30,2022-09-16T05:45:39,2022-09-16T17:50:03,0.69,"Rain, Partially cloudy",Partly cloudy throughout the day with late afternoon rain.,rain,"96741099999,WIII,96739099999,WIHH,96749099999,96751099999,96745099999,96749599999"
"-6.2155, 106.803",9/17/2022,33,25,28.7,40.6,25,32.3,23.9,76.4,0,0,0,rain,0,0,28.1,22.3,59.6,1009.9,41.9,6.6,270.7,23.3,10,30,2022-09-17T05:45:08,2022-09-17T17:49:52,0.72,Partially cloudy,Partly cloudy throughout the day.,partly-cloudy-day,"96741099999,WIII,96739099999,96749099999,96751099999,96745099999"
"-6.2155, 106.803",9/18/2022,32,24,28.3,37.9,24,32.3,24.6,81,0.845,100,4.17,rain,0,0,24.1,13.9,299.6,1010.4,48.4,5.6,255,22,9,30,2022-09-18T05:44:36,2022-09-18T17:49:40,0.75,"Rain, Partially cloudy",Partly cloudy throughout the day with afternoon rain.,rain,"96737099999,96741099999,WIII,96739099999,96749099999,96751099999,96745099999"
"-6.2155, 106.803",9/19/2022,33.8,25,28.3,38.1,25,31.1,23.6,76.9,1.07,100,4.17,rain,0,0,22.7,18.4,297.9,1010.7,47,5.8,243.4,21.1,8,30,2022-09-19T05:44:05,2022-09-19T17:49:29,0.78,"Rain, Partially cloudy",Partly cloudy throughout the day with late afternoon rain.,rain,"96741099999,WIII,96739099999,WIHH,96749099999,96751099999,96745099999,96749599999"
"-6.2155, 106.803",9/20/2022,32.1,24,28.4,36.3,24,31,22.6,71.8,0,0,0,rain,0,0,19.4,18.2,357.1,1010.3,49.8,6,272,23.5,9,30,2022-09-20T05:43:33,2022-09-20T17:49:18,0.82,Partially cloudy,Partly cloudy throughout the day.,partly-cloudy-day,"96741099999,WIII,96739099999,WIHH,96749099999,96751099999,96745099999,96749599999"
"-6.2155, 106.803",9/21/2022,32.1,24,28.3,39.3,24,32.1,24,77.8,1.654,100,20.83,rain,0,0,22.3,16.6,334.8,1010.3,61.9,6,245,21.1,8,30,2022-09-21T05:43:02,2022-09-21T17:49:07,0.85,"Rain, Partially cloudy",Partly cloudy throughout the day with rain.,rain,"96741099999,WIII,96739099999,WIHH,96749099999,96751099999,96745099999,96749599999"
"-6.2155, 106.803",9/22/2022,31.3,25,27.6,38,25,30.5,24.2,81.9,19.037,100,16.67,rain,0,0,40.7,22.3,239.3,1009.9,57.2,4.9,237.3,20.5,8,30,2022-09-22T05:42:30,2022-09-22T17:48:56,0.88,"Rain, Partially cloudy",Partly cloudy throughout the day with rain.,rain,"96741099999,WIII,96739099999,WIHH,96749099999,96751099999,96745099999,96749599999"
"-6.2155, 106.803",9/23/2022,32.7,25,27.9,38.3,25,30.2,24,80.7,1.613,100,20.83,rain,0,0,24.5,20.5,278.4,1010,56.8,5.6,222.5,19.3,8,30,2022-09-23T05:41:59,2022-09-23T17:48:45,0.91,"Rain, Partially cloudy",Partly cloudy throughout the day with a chance of rain throughout the day.,rain,"96741099999,WIII,96739099999,WIHH,96749099999,96751099999,96745099999,96749599999"
"-6.2155, 106.803",9/24/2022,33.4,24,28.6,42.1,24,32.3,24.1,77.6,0,0,0,rain,0,0,42.5,24.1,69.9,1009.1,47.4,6.1,270.1,23.3,9,30,2022-09-24T05:41:28,2022-09-24T17:48:34,0.95,Partially cloudy,Partly cloudy throughout the day.,partly-cloudy-day,"96741099999,WIII,96739099999,96749099999,96751099999,96745099999"
"-6.2155, 106.803",9/25/2022,32,25,28.6,38.8,25,32.3,24.2,77.7,0,0,0,rain,0,0,24.5,20.5,335.8,1009.3,43.7,7.2,278.3,23.9,9,30,2022-09-25T05:40:57,2022-09-25T17:48:23,0.98,Partially cloudy,Partly cloudy throughout the day.,partly-cloudy-day,"96737099999,96741099999,WIII,96739099999,96749099999,96751099999,96745099999"
"-6.2155, 106.803",9/26/2022,34,24,29,39.3,24,31.8,23.2,72.9,9.992,100,8.33,rain,0,0,19.1,18.4,305.2,1009.1,45.8,6.3,275.3,23.8,9,30,2022-09-26T05:40:26,2022-09-26T17:48:13,0,"Rain, Partially cloudy",Partly cloudy throughout the day with late afternoon rain.,rain,"96741099999,WIII,96739099999,WIHH,96749099999,96751099999,96745099999,96749599999"
"-6.2155, 106.803",9/27/2022,33,25,28.9,38.7,25,31.8,23.1,71.9,0.001,100,4.17,rain,0,0,21.6,18.4,350.4,1007.8,43.9,6.8,281.7,24.3,9,10,2022-09-27T05:39:55,2022-09-27T17:48:02,0.05,"Rain, Partially cloudy",Partly cloudy throughout the day with late afternoon rain.,rain,"96741099999,WIII,96739099999,WIHH,96749099999,96751099999,96745099999,96749599999"
"-6.2155, 106.803",9/28/2022,33,25,29,37.5,25,32.2,23.4,73.4,0.003,100,4.17,rain,0,0,18.4,19.9,338.2,1007.2,51.2,6,272.6,23.5,9,10,2022-09-28T05:39:25,2022-09-28T17:47:52,0.08,"Rain, Partially cloudy",Partly cloudy throughout the day with late afternoon rain.,rain,"96741099999,WIII,96739099999,WIHH,96749099999,96751099999,96745099999,96749599999"
"-6.2155, 106.803",9/29/2022,32.5,26,29,36.4,26,32.3,23.3,72.7,0.051,100,4.17,rain,0,0,23,18.4,55.2,1007.8,52.5,6.5,264.8,22.7,9,10,2022-09-29T05:38:54,2022-09-29T17:47:42,0.12,"Rain, Partially cloudy",Partly cloudy throughout the day with afternoon rain.,rain,"96741099999,WIII,96739099999,WIHH,96749099999,96751099999,96745099999,96749599999"
"-6.2155, 106.803",9/30/2022,32.5,25,28.6,36.7,25,31.8,23.6,75.4,0,0,0,rain,0,0,34.9,27.7,88.9,1008.9,46.9,6.2,208.2,17.9,7,10,2022-09-30T05:38:24,2022-09-30T17:47:32,0.15,Partially cloudy,Partly cloudy throughout the day.,partly-cloudy-day,"96741099999,WIII,96739099999,WIHH,96749099999,96751099999,96745099999,96749599999"
"-6.2155, 106.803",10/1/2022,34,26,29.7,42,26,34.7,24.6,74.7,0.025,100,4.17,rain,0,0,27,24,69,1009,49.4,7.6,244.9,21.2,8,10,2022-10-01T05:37:54,2022-10-01T17:47:23,0.19,"Rain, Partially cloudy",Partly cloudy throughout the day with late afternoon rain.,rain,"96741099999,WIII,96739099999,96749099999,96751099999,96745099999"
"-6.2155, 106.803",10/2/2022,30,24,27,36.2,24,29.6,24.5,86.6,17.167,100,12.5,rain,0,0,42.5,12,295.2,1009,59,6.3,231.1,20,9,10,2022-10-02T05:37:24,2022-10-02T17:47:14,0.23,"Rain, Partially cloudy",Partly cloudy throughout the day with a chance of rain throughout the day.,rain,"96741099999,WIII,96739099999,96749099999,96751099999,96745099999"
"-6.2155, 106.803",10/3/2022,33,25,28.4,40.6,25,31.6,24.4,80.3,2.013,100,12.5,rain,0,0,24.5,14.8,275.1,1008.6,65.1,6,197.4,17.1,8,30,2022-10-03T05:36:55,2022-10-03T17:47:05,0.25,"Rain, Partially cloudy",Partly cloudy throughout the day with rain.,rain,"96741099999,WIII,96739099999,WIHH,96749099999,96751099999,96745099999,96749599999"
"-6.2155, 106.803",10/4/2022,32,24.8,26.9,39.2,24.8,28.7,24.1,85.5,21.325,100,20.83,rain,0,0,46.4,22.3,178.5,1008.8,59.9,5.3,172.6,15.1,8,30,2022-10-04T05:36:26,2022-10-04T17:46:57,0.3,"Rain, Partially cloudy",Partly cloudy throughout the day with rain.,rain,"96741099999,WIII,96739099999,WIHH,96749099999,96751099999,96745099999,96749599999"
"-6.2155, 106.803",10/5/2022,30,25,27.3,36.2,25,30.2,24.6,85.6,4.287,100,8.33,rain,0,0,25.6,16.6,54.4,1009.5,53.1,5.9,225.6,19.5,8,10,2022-10-05T05:35:57,2022-10-05T17:46:48,0.33,"Rain, Partially cloudy",Partly cloudy throughout the day with rain.,rain,"96741099999,WIII,96739099999,WIHH,96749099999,96751099999,96745099999,96749599999"
"-6.2155, 106.803",10/6/2022,32,25,27.2,39.2,25,29.3,24.4,85.5,38.722,100,16.67,rain,0,0,27.7,24.9,197.3,1009.7,60.6,5.4,207.5,17.8,8,10,2022-10-06T05:35:29,2022-10-06T17:46:40,0.37,"Rain, Partially cloudy",Partly cloudy throughout the day with rain.,rain,"96741099999,WIII,96739099999,WIHH,96749099999,96751099999,96745099999,96749599999"
"-6.2155, 106.803",10/7/2022,30.9,24,26.5,36.8,24,27.9,24,87.4,5.491,100,20.83,rain,0,0,37.1,23.6,249.9,1010.4,67.6,5.8,150.7,12.9,6,30,2022-10-07T05:35:01,2022-10-07T17:46:33,0.4,"Rain, Partially cloudy",Partly cloudy throughout the day with a chance of rain throughout the day.,rain,"96741099999,WIII,96739099999,WIHH,96749099999,96751099999,96745099999,96749599999"
"-6.2155, 106.803",10/8/2022,32.5,23,27.6,36.8,23,30,23.1,77.6,0.049,100,12.5,rain,0,0,21.6,22.3,250.6,1010.2,50.5,7.6,186.4,16.2,7,30,2022-10-08T05:34:34,2022-10-08T17:46:26,0.44,"Rain, Partially cloudy",Partly cloudy throughout the day with rain.,rain,"96741099999,WIII,96739099999,96749099999,96751099999,96745099999"
"-6.2155, 106.803",10/9/2022,32,25,27.6,39.2,25,30.1,24.1,81.8,1.131,100,8.33,rain,0,0,23,29.5,263.1,1010.3,57.4,5.8,245,21.2,9,30,2022-10-09T05:34:07,2022-10-09T17:46:19,0.48,"Rain, Partially cloudy",Partly cloudy throughout the day with late afternoon rain.,rain,"96741099999,WIII,96739099999,96749099999,96751099999,96745099999"
"-6.2155, 106.803",10/10/2022,31.5,24,27.5,35.6,24,29.9,23.7,80.9,0.025,100,4.17,rain,0,0,21.2,15.7,292.9,1011.1,54,6.1,193,16.6,7,30,2022-10-10T05:33:40,2022-10-10T17:46:13,0.5,"Rain, Partially cloudy",Partly cloudy throughout the day with morning rain.,rain,"96741099999,WIII,96739099999,WIHH,96749099999,96751099999,96745099999,96749599999"
"-6.2155, 106.803",10/11/2022,31.7,24,27.2,36.5,24,29.4,23.8,82.7,15.738,100,8.33,rain,0,0,27.4,22.3,253.4,1010.4,53.2,5.6,232.1,20,9,30,2022-10-11T05:33:14,2022-10-11T17:46:07,0.54,"Rain, Partially cloudy",Partly cloudy throughout the day with rain.,rain,"96741099999,WIII,96739099999,WIHH,96749099999,96751099999,96745099999,96749599999"
"-6.2155, 106.803",10/12/2022,31.7,24,27.6,36.7,24,30.1,23.5,79.3,0.193,100,16.67,rain,0,0,22.7,18.4,79.7,1010.3,50.8,6.3,201.4,17.3,8,10,2022-10-12T05:32:48,2022-10-12T17:46:02,0.58,"Rain, Partially cloudy",Partly cloudy throughout the day with rain.,rain,"96741099999,WIII,96739099999,WIHH,96749099999,96751099999,96745099999,96749599999"
"-6.2155, 106.803",10/13/2022,32.5,25,27.4,37.2,25,29.2,23.9,82.3,22.263,100,12.5,rain,0,0,35.3,21.6,201,1009.4,60.5,5.5,210.6,18.2,7,10,2022-10-13T05:32:23,2022-10-13T17:45:57,0.61,"Rain, Partially cloudy",Partly cloudy throughout the day with rain.,rain,"96737099999,96741099999,WIII,96739099999,WIHH,96749099999,96751099999,96745099999,96749599999"
"-6.2155, 106.803",10/14/2022,32.4,25,28.1,37.3,25,30.7,23.8,78.7,0.088,100,4.17,rain,0,0,26.3,22.9,296.8,1008.1,50.4,6.6,212.3,18.4,8,30,2022-10-14T05:31:58,2022-10-14T17:45:53,0.64,"Rain, Partially cloudy",Partly cloudy throughout the day with late afternoon rain.,rain,"96741099999,WIII,96739099999,WIHH,96749099999,96751099999,96745099999,96749599999"
"-6.2155, 106.803",10/15/2022,32,25,27.9,39.2,25,31.1,24.3,81.6,10.19,100,20.83,rain,0,0,21.6,18.4,177.7,1008.5,57.5,6.6,211.7,18.3,7,10,2022-10-15T05:31:34,2022-10-15T17:45:49,0.67,"Rain, Partially cloudy",Partly cloudy throughout the day with rain.,rain,"96741099999,WIII,96739099999,96749099999,96751099999,96745099999"
"-6.2155, 106.803",10/16/2022,32,25,28.2,39.2,25,32.3,25,83.2,8.233,100,4.17,rain,0,0,23,13,5.6,1010.1,54.1,6.7,237.5,20.4,8,30,2022-10-16T05:31:11,2022-10-16T17:45:46,0.7,"Rain, Partially cloudy",Partly cloudy throughout the day with afternoon rain.,rain,"96741099999,WIII,96739099999,96749099999,96751099999,96745099999"
"-6.2155, 106.803",10/17/2022,32.7,25,28.7,38.8,25,33,24.8,80.4,3.382,100,12.5,rain,0,0,24.5,22.3,192.3,1009.7,52.1,5.7,236.3,20.3,9,10,2022-10-17T05:30:48,2022-10-17T17:45:43,0.74,"Rain, Partially cloudy",Partly cloudy throughout the day with rain.,rain,"96741099999,WIII,96739099999,WIHH,96749099999,96751099999,96745099999,96749599999"
"-6.2155, 106.803",10/18/2022,31,26,27.8,36.8,26,30.9,24.5,82.7,0.261,100,16.67,rain,0,0,22,14.6,323.9,1009.1,52.4,5.1,196.5,16.9,7,30,2022-10-18T05:30:26,2022-10-18T17:45:41,0.75,"Rain, Partially cloudy",Partly cloudy throughout the day with rain.,rain,"96741099999,WIII,96739099999,WIHH,96749099999,96751099999,96745099999,96749599999"
"-6.2155, 106.803",10/19/2022,31.5,25,27.1,37.1,25,28.8,24.4,86.1,17,100,8.33,rain,0,0,20.5,18.4,236.1,1009.2,63.3,5.1,139.7,12,5,30,2022-10-19T05:30:04,2022-10-19T17:45:39,0.8,"Rain, Partially cloudy",Partly cloudy throughout the day with rain.,rain,"96741099999,WIII,96739099999,WIHH,96749099999,96751099999,96745099999,96749599999"
"-6.2155, 106.803",10/20/2022,30.7,25,27.4,36.2,25,30.4,24.5,84.7,0.086,100,20.83,rain,0,0,18.4,14.8,238.7,1010,57.3,5.8,186.4,16,6,10,2022-10-20T05:29:44,2022-10-20T17:45:38,0.83,"Rain, Partially cloudy",Partly cloudy throughout the day with a chance of rain throughout the day.,rain,"96741099999,WIII,96739099999,WIHH,96749099999,96751099999,96745099999,96749599999"
"-6.2155, 106.803",10/21/2022,31,25,27.7,40.6,25,31.1,24.2,81.5,0.173,100,12.5,rain,0,0,23,16.6,253.6,1010.8,58.2,7.2,170.6,14.7,7,30,2022-10-21T05:29:23,2022-10-21T17:45:38,0.86,"Rain, Partially cloudy",Partly cloudy throughout the day with rain.,rain,"96741099999,WIII,96739099999,WIHH,96749099999,96751099999,96745099999,96749599999"
"-6.2155, 106.803",10/22/2022,32,25,28.5,39.1,25,32.7,24.7,80.7,0.036,100,12.5,rain,0,0,21.2,13,289.9,1010.5,52.5,7.2,217.9,18.8,9,30,2022-10-22T05:29:04,2022-10-22T17:45:38,0.9,"Rain, Partially cloudy",Partly cloudy throughout the day with rain.,rain,"96741099999,WIII,96739099999,96749099999,96751099999,96745099999"
"-6.2155, 106.803",10/23/2022,32.2,25,28.3,39.2,25,32,24.7,82.1,38.912,100,12.5,rain,0,0,23,22.3,259.5,1010.5,66.4,6.5,111.1,9.6,5,30,2022-10-23T05:28:45,2022-10-23T17:45:39,0.93,"Rain, Partially cloudy",Partly cloudy throughout the day with rain clearing later.,rain,"96741099999,WIII,96739099999,96749099999,96751099999,96745099999"
"-6.2155, 106.803",10/24/2022,33.1,25,27.9,37.2,25,30.1,23.3,77.5,0.007,100,8.33,rain,0,0,40.7,28.2,250.3,1010.3,51.7,7.6,207,18,7,30,2022-10-24T05:28:27,2022-10-24T17:45:40,0.96,"Rain, Partially cloudy",Partly cloudy throughout the day with early morning rain.,rain,"96737099999,96741099999,WIII,96739099999,WIHH,96749099999,96751099999,96745099999,96749599999"
"-6.2155, 106.803",10/25/2022,31.5,25,27,37.4,25,29,24.2,85.2,2.301,100,12.5,rain,0,0,36.7,22.3,261.5,1010.3,49.9,6.2,167.4,14.5,6,30,2022-10-25T05:28:10,2022-10-25T17:45:42,0,"Rain, Partially cloudy",Partly cloudy throughout the day with rain.,rain,"96741099999,WIII,WIHH,96739099999,96749099999,96751099999,96749599999,96745099999"
